video_id,university_name,category,topic,search_query,title,description,channel_name,upload_date,upload_year,views,likes,comment_count,duration,language,video_url,relevance_score,relevance_label
2jQfqVhbXnc,Manipur University,controversies,scam,Manipur University scam,Manipur University Admission 2025 | Expected CUET Cutoffs! #CUETUG2025 #UGCutoffs,For All Your Queries Fill out This Profile Analysis Form : https://shorturl.at/4cR8c JOIN OUR WHATSAPP COMMUNITY FOR ...,CUET by Studentkhabri,2025-06-25T16:13:23Z,2025,1597,29,1,PT1M7S,unknown,https://www.youtube.com/watch?v=2jQfqVhbXnc,13,Relevant
AY9YWfzxcgA,Manipur University,controversies,scam,Manipur University scam,&quot;EXPLOSION AT MANIPUR UNIVERSITY&quot;  || ON NORTHEAST DIALOGUE 05|04|26 [LIVE],"TOPIC : ""EXPLOSION AT MANIPUR UNIVERSITY"" || ON NORTHEAST DIALOGUE 05|04|26 [LIVE] HOST: RAKHESHWAR ...",NEw TV,2026-04-05T14:18:33Z,2026,12142,0,6,PT1H24M16S,unknown,https://www.youtube.com/watch?v=AY9YWfzxcgA,13,Relevant
Ka2dMQAqMsw,Manipur University,controversies,scam,Manipur University scam,Manipur University Students att*cked - Conversation with MU students | The Untold Story,,Kewe Mero,2023-05-15T11:45:54Z,2023,79938,3582,557,PT12M59S,unknown,https://www.youtube.com/watch?v=Ka2dMQAqMsw,13,Relevant
ZiCw3QFGB1I,Manipur University,controversies,scam,Manipur University scam,Manipur University campus 😍,,Lone chemist,2024-10-26T00:52:24Z,2024,3309,83,1,PT42S,unknown,https://www.youtube.com/watch?v=ZiCw3QFGB1I,13,Relevant
qpOGuZgr5cA,Manipur University,controversies,scam,Manipur University scam,Manipur University Team … ❤️ #manipur #function #college #imphal,manipuri #manipurijagoi #Manipuridance.,Tom Manipur,2025-03-31T10:04:03Z,2025,10856,207,1,PT31S,unknown,https://www.youtube.com/watch?v=qpOGuZgr5cA,13,Relevant
ma-oarVqv0A,Manipur University,controversies,scam,Manipur University scam,Glimpse of my campus life | Manipur University #unilife #manipuruniversity #manipur #youtubeshorts,,Amy Lamabam ,2024-09-04T18:44:04Z,2024,1826,63,4,PT17S,unknown,https://www.youtube.com/watch?v=ma-oarVqv0A,13,Relevant
w9v-nsrQmcM,Manipur University,controversies,scam,Manipur University scam,Manipur University | Long Live Manipur | Long Live Students Movement |,bjp #congress #nsui #amsu #msf #manipuruniversity #universityelection #delhiuniversity #jnu.,Young Meetei Society,2025-09-24T04:04:49Z,2025,2930,8,1,PT15S,unknown,https://www.youtube.com/watch?v=w9v-nsrQmcM,13,Relevant
Q_UomkYsCWg,Manipur University,controversies,scam,Manipur University scam,Manipur University Central Library #manipur,,Rib's Archive,2025-01-29T07:10:31Z,2025,5265,51,4,PT9S,unknown,https://www.youtube.com/watch?v=Q_UomkYsCWg,13,Relevant
J6WUCQCxt14,Tezpur University,controversies,scam,Tezpur University scam,“37 LPA Highest Package | Tezpur University Placements”,,Prabhat Ranjan,2026-01-18T02:30:20Z,2026,4480,71,2,PT28S,unknown,https://www.youtube.com/watch?v=J6WUCQCxt14,13,Relevant
4Xnm7w1xAto,Manipur University,controversies,scam,Manipur University scam,UNIFEST 2025-26: MANIPUR UNIVERSITY NA OVERALL CHAMPION GI TITLE LOURAKKHRE,SKTV #SKTVMANIPUR #manipur #news #manipurnews #newsfrommanipur #manipurinews #manipuri #imphal #manipursktv ...,SKTV,2026-02-21T12:16:48Z,2026,2832,119,4,PT4M5S,unknown,https://www.youtube.com/watch?v=4Xnm7w1xAto,13,Relevant
p8i-2HJQ5us,Manipur University,controversies,scam,Manipur University scam,Manipur university #manipur #university #economics,,Mbchanu,2024-07-23T01:51:04Z,2024,14148,192,7,PT10S,unknown,https://www.youtube.com/watch?v=p8i-2HJQ5us,13,Relevant
W0f18XUqzL4,Manipur University,controversies,scam,Manipur University scam,Planning To Join Manipur University? Watch this first ! All Details #manipuruniversity#hostellife,"Welcome to Manipur University In this video, I'm sharing everything you need to know about hostel life, campus facilities, and ...",Jai's Moments,2025-07-24T16:52:52Z,2025,2997,85,60,PT4M5S,unknown,https://www.youtube.com/watch?v=W0f18XUqzL4,13,Relevant
H31c7uEYx00,Manipur University,controversies,scam,Manipur University scam,Masak fajabi mym di MANIPUR UNIVERSITY da loi lei hw re #fashion,,Nerish Wahengbam,2024-10-17T16:28:06Z,2024,330620,8925,35,PT24S,unknown,https://www.youtube.com/watch?v=H31c7uEYx00,13,Relevant
T33blFbAeBE,Manipur University,controversies,scam,Manipur University scam,Manipur University Corruption Case: ED na Property Seized Toukhre I Connect News,ManipurUniversity #ED #ConnectNews #ManipurNews #ManipurNewsUpdates ...,CONNECT NEWS,2025-10-10T03:51:38Z,2025,12063,322,41,PT4M39S,unknown,https://www.youtube.com/watch?v=T33blFbAeBE,13,Relevant
2KU_G9ACOxo,Mizoram University,controversies,scam,Mizoram University scam,#mizoram University Campus#,,Natural,2023-08-16T19:20:58Z,2023,401,34,0,PT33S,unknown,https://www.youtube.com/watch?v=2KU_G9ACOxo,13,Relevant
7DHyANJjG9E,Mizoram University,controversies,scam,Mizoram University scam,TRIBAL GIRL&#39;S HOSTEL AT MIZORAM UNIVERSITY,,BKL Visual Production,2023-06-15T09:24:07Z,2023,3757,38,0,PT51S,unknown,https://www.youtube.com/watch?v=7DHyANJjG9E,13,Relevant
4b3iC5GV7Zc,Mizoram University,controversies,scam,Mizoram University scam,Evening Travel At Mizoram University Campus #mizoram #mizoramuniversity @JagadishBehera95,,Jagadish Behera,2024-02-25T06:25:11Z,2024,1745,0,0,PT12S,unknown,https://www.youtube.com/watch?v=4b3iC5GV7Zc,13,Relevant
LMVyxnLKlKc,Mizoram University,controversies,scam,Mizoram University scam,Monsoon at Mizoram University #mzu #mizoramuniversity #aizawl #shortsvideo #shortsfeed #youtubeshort,,Purba Bindas Vlogging,2025-05-23T03:30:13Z,2025,38420,1035,41,PT19S,unknown,https://www.youtube.com/watch?v=LMVyxnLKlKc,13,Relevant
4XrkdkGAE04,Mizoram University,controversies,scam,Mizoram University scam,"09. Prof  H  Malsawmi (Mizoram University) (FIP UGC HRDC MzU Feb 09, 2023)","Emotional Intelligence for Teachers Prof. H. Malsawmi Department of Education Mizoram University, Aizawl.",Bhartendu Singh,2023-02-18T18:37:30Z,2023,65,1,0,PT1H17M47S,unknown,https://www.youtube.com/watch?v=4XrkdkGAE04,13,Relevant
7lKUXgd6R2E,Mizoram University,controversies,scam,Mizoram University scam,Christmas and New year Fest at Mizoram University | IIMC North East campus #mizoramumiversity #iimc,,VlogPorter,2023-01-19T13:30:02Z,2023,391,12,7,PT3M31S,unknown,https://www.youtube.com/watch?v=7lKUXgd6R2E,13,Relevant
29GpCG35KBg,Mizoram University,controversies,scam,Mizoram University scam,Day 1 Education Tour with Students of Mizoram University X Destinatia,Destinatia #studytour #mizoramuniversity #travelvlog Hello Everyone! Thanks for watching our video... About the video: The ...,DESTINATIA,2023-01-08T12:30:07Z,2023,197,10,1,PT3M17S,unknown,https://www.youtube.com/watch?v=29GpCG35KBg,13,Relevant
oOCbrUGvz68,Mizoram University,controversies,scam,Mizoram University scam,"Mizoram University Online: Courses, Admission Process, Fees, Eligibility #mizoramuniversityonline",Fill out this form below to get a free profile analysis by our expert counselor: https://forms.gle/Nbb8r3LY9fDbJpwt8 For more ...,My College Buddy,2024-08-07T14:00:45Z,2024,2738,43,12,PT3M57S,unknown,https://www.youtube.com/watch?v=oOCbrUGvz68,13,Relevant
pmJUlbfK8DY,Mizoram University,controversies,scam,Mizoram University scam,Sports day in Mizoram University Football ground 🤾⛹️🤾,,mahima tiwari,2023-05-10T13:49:56Z,2023,334,21,0,PT15S,unknown,https://www.youtube.com/watch?v=pmJUlbfK8DY,13,Relevant
IA13NaNVEL8,Mizoram University,controversies,scam,Mizoram University scam,"Beauty of Campus, mizoram University #collegelife #campus #travel #universitycampus @Sonuit247",,Aware.,2023-09-11T11:57:16Z,2023,22046,323,27,PT16S,unknown,https://www.youtube.com/watch?v=IA13NaNVEL8,13,Relevant
OCu6yVSdijc,Mizoram University,controversies,scam,Mizoram University scam,"A two-day Mizo Translation Workshop got inaugurated on 17 March 2026 at Mizoram University, Aizawl","A two-day Mizo Translation Workshop got inaugurated on 17 March 2026 at Mizoram University, Aizawl, organised by National ...",NBT India,2026-03-17T11:48:24Z,2026,62,0,0,PT2M25S,unknown,https://www.youtube.com/watch?v=OCu6yVSdijc,13,Relevant
LWcaW_v4V2Y,Mizoram University,controversies,scam,Mizoram University scam,Mizoram University $ Dancing clouds #mzu #mizoram  #mizoramuniversity ​@purbabindasvlogging7948,Follow me https://instagram.com/purba_bindas_vlogging?igshid=ZDdkNTZiNTM= ...,Purba Bindas Vlogging,2023-09-08T11:43:47Z,2023,368,19,8,PT3M41S,unknown,https://www.youtube.com/watch?v=LWcaW_v4V2Y,13,Relevant
CvyhtsdCI6k,Mizoram University,controversies,scam,Mizoram University scam,Mizoram University short 8k😍😍😍😍😘😘😘😇😚👌👌🧖‍♂️🧖‍♀️,,kashipur Vs @ 786 Assam cachar silchar ,2023-08-06T05:50:52Z,2023,263,10,0,PT16S,unknown,https://www.youtube.com/watch?v=CvyhtsdCI6k,13,Relevant
LlmNXIDpMQo,Mizoram University,controversies,scam,Mizoram University scam,"A two-day Mizo Translation Workshop organised by National Book Trust, India at Mizoram University","A two-day Mizo Translation Workshop organised by National Book Trust, India was held on 17–18 March 2026 at the Seminar ...",NBT India,2026-03-18T16:55:07Z,2026,75,4,0,PT5M1S,unknown,https://www.youtube.com/watch?v=LlmNXIDpMQo,13,Relevant
flh7gr-ghXY,Mizoram University,controversies,scam,Mizoram University scam,Admissions open for UG/PG/PhD in multiple subjects @ Mizoram University #environmentalscience,Link to more jobs and information https://www.youtube.com/playlist?list=PLhLtLH2OxiRpfD-0TmG-6Eeis20mA8AYF Mizoram ...,Dr. Annapurna Singh,2023-06-30T23:20:21Z,2023,216,5,16,PT4M34S,unknown,https://www.youtube.com/watch?v=flh7gr-ghXY,13,Relevant
E8eX7csr3bE,Mizoram University,controversies,scam,Mizoram University scam,Mizoram University Assignments,,Prime College Of Correspondence Studies,2023-04-20T09:14:28Z,2023,491,5,3,PT4M13S,unknown,https://www.youtube.com/watch?v=E8eX7csr3bE,13,Relevant
HxMOeoED7q0,Mizoram University,controversies,scam,Mizoram University scam,Class Picnic || Zoology Department 2nd Sem || 2022-24 Batch || Mizoram University MZU,,The Meghalayan Wanderer,2023-06-11T05:30:04Z,2023,577,21,7,PT14M45S,unknown,https://www.youtube.com/watch?v=HxMOeoED7q0,13,Relevant
80xbXKnFquI,Mizoram University,controversies,scam,Mizoram University scam,"Teachers Day celebration 2023 || Department of Zoology, Mizoram University || MZU || Aizawl",,The Meghalayan Wanderer,2023-09-05T10:15:53Z,2023,3718,87,2,PT17S,unknown,https://www.youtube.com/watch?v=80xbXKnFquI,13,Relevant
ed8DmZ81PuI,Mizoram University,controversies,scam,Mizoram University scam,Mizoram University Fresher Social cum Orientation #mizoramuniversity #aizawl #mizoram #neindia,,The Meghalayan Wanderer,2023-08-25T11:32:49Z,2023,824,25,4,PT52S,unknown,https://www.youtube.com/watch?v=ed8DmZ81PuI,13,Relevant
dpaXq1YOjM0,Mizoram University,controversies,scam,Mizoram University scam,Beautiful Mizoram University,,windofindia,2023-05-23T14:10:41Z,2023,978,18,0,PT2M51S,unknown,https://www.youtube.com/watch?v=dpaXq1YOjM0,13,Relevant
Wt8xRxZoMqk,Mizoram University,controversies,scam,Mizoram University scam,Mizoram University पहुंची Lallantop की टीम से छात्र ने किसकी शिकायत कर दी? | Mizoram Election 2023,"If you preparing for UPSC CSE then please watch Unacademy Mudde Ki Baat, https://yt.openinapp.co/u644b खबरों को ...",The Lallantop,2023-11-02T17:45:02Z,2023,27483,584,58,PT10M29S,unknown,https://www.youtube.com/watch?v=Wt8xRxZoMqk,13,Relevant
FroE9tgJnoA,Tezpur University,controversies,scam,Tezpur University scam,"Tezpur University Distance Learning Honest Review | Fees Only ₹17,000? Truth Revealed",Want to book a personal call with me or connect with a student/mentor from your dream college? Click here: ...,Sandhya- College Review ,2026-03-17T09:30:22Z,2026,574,6,0,PT1M27S,unknown,https://www.youtube.com/watch?v=FroE9tgJnoA,13,Relevant
HEd3dkWGoJ8,Tezpur University,controversies,scam,Tezpur University scam,"Tezpur University Full Review 🔥 Placement, Cutoff, Campus &amp; Admission Process","EDUCATION Ji – B.Tech Admission 2025 Open Now! For Any Admission Query, Fill This Form Now ...",Education Ji,2025-06-13T13:00:38Z,2025,6774,90,19,PT8M56S,unknown,https://www.youtube.com/watch?v=HEd3dkWGoJ8,13,Relevant
nXmT8qu4nj4,Assam University,controversies,scam,Assam University scam,Ganesh Chaturvedi || Boys hostel-5 || Assam University || Silchar || Assam || Northeast ||,,Jeffrey Hasnu,2023-09-22T18:11:40Z,2023,1133,73,0,PT53S,unknown,https://www.youtube.com/watch?v=nXmT8qu4nj4,13,Relevant
BgVD7Ar09VE,Tripura University,controversies,scam,Tripura University scam,Panda Mwthak Rwjakma Koktwma jora kaya sini | Tripura University | indigenous North-east student,"DONGOUR TV CHANNEL is the exclusive indigeneous kokborok TV channel of Tripura, INDIA which features the programme of ...",DONGOUR TV CHANNEL,2025-09-20T05:11:34Z,2025,72536,1624,128,PT19M41S,unknown,https://www.youtube.com/watch?v=BgVD7Ar09VE,13,Relevant
nS3veukdxeE,Assam University,controversies,scam,Assam University scam,20th Convocation Assam university,,Barbie Dance Academy ,2023-03-06T08:42:18Z,2023,919,35,1,PT16S,unknown,https://www.youtube.com/watch?v=nS3veukdxeE,13,Relevant
8Wk4uy8qmdI,Tripura University,controversies,scam,Tripura University scam,TRIPURA UNIVERSITY,shortsvideo.,Confidence Building,2023-05-09T05:01:57Z,2023,4414,70,0,PT12S,unknown,https://www.youtube.com/watch?v=8Wk4uy8qmdI,13,Relevant
khytdjuS-T0,Assam University,controversies,scam,Assam University scam,ASSAM UNIVERSITY SHILCHAR || @Official_KishoreNomosudra,"Hello Guys welcome Music by ""NCS"" #pw #viral #hostellife #viralvideo #assam #silchar #youtubevideo #hostelfees #students ...",Kishore Nomosudra,2026-05-11T07:04:22Z,2026,388,0,5,PT1M14S,unknown,https://www.youtube.com/watch?v=khytdjuS-T0,13,Relevant
zB6_2AEWfk0,Tripura University,controversies,scam,Tripura University scam,Massive fire at the Tripura University in the Lab of Forestry and Biodiversity Department,"Welcome to Chini Khorang Tripura – Your Trusted Source for News, Culture & Updates from Tripura! Stay informed with the latest ...",CHINI KHORANG TRIPURA,2023-05-09T07:37:15Z,2023,400,9,0,PT1M31S,unknown,https://www.youtube.com/watch?v=zB6_2AEWfk0,13,Relevant
QAaeTpQ2IZg,Tripura University,controversies,scam,Tripura University scam,Hakotor ni Vice President ni Manjakmungo Tripura university oh Khlaijakha Convocation Panda,"Phainai 2047 Bisio Vikshit Bharat ni Emang Mwkthang Wngnai, Abo Kaisa Kotor Laibuma oh Swijaknai, Development ni bagwi ...",CHINI KHORANG TRIPURA,2026-03-08T13:02:01Z,2026,474,11,0,PT9M41S,unknown,https://www.youtube.com/watch?v=QAaeTpQ2IZg,13,Relevant
DLc7qz_-E8g,Assam University,controversies,scam,Assam University scam,Assam University Silchar ✍️✍️📖❤️💕,,Minki Bin,2023-10-13T15:11:59Z,2023,45,21,4,PT31S,unknown,https://www.youtube.com/watch?v=DLc7qz_-E8g,13,Relevant
mwJhqsXGfko,Tripura University,controversies,scam,Tripura University scam,Tripura University Entrance 2025 Books | CUET Study Materials | CUET Coaching Agartala |,,School Of Learning Agartala,2025-02-22T09:38:00Z,2025,1383,0,0,PT10S,unknown,https://www.youtube.com/watch?v=mwJhqsXGfko,13,Relevant
Fs4NR5e99F8,Assam University,controversies,scam,Assam University scam,Assam university // silchar//main gate //cool weather,,heyylilll,2023-04-21T09:01:34Z,2023,404,20,0,PT14S,unknown,https://www.youtube.com/watch?v=Fs4NR5e99F8,13,Relevant
ewukDxg7oms,Tripura University,controversies,scam,Tripura University scam,Tripura University class room #Lets The Begin @letsthebegin #letsthebegin,Lets The Begin @letsthebegin #letsthebegin.,Lets The Begin,2023-04-11T07:45:30Z,2023,983,21,0,PT16S,unknown,https://www.youtube.com/watch?v=ewukDxg7oms,13,Relevant
Jg-MxzOvdsg,Tripura University,controversies,scam,Tripura University scam,Tripura University || Pariksha Babhan||.,,Diman Debbarma,2023-09-25T12:31:52Z,2023,188,10,0,PT38S,unknown,https://www.youtube.com/watch?v=Jg-MxzOvdsg,13,Relevant
WX_lau5Bhqg,Tripura University,controversies,scam,Tripura University scam,CU tripura University review placement admission hostel #cuetpgupdate #cucetpg,,Helpers CUET preparation,2025-09-12T18:30:53Z,2025,284,5,0,PT13S,unknown,https://www.youtube.com/watch?v=WX_lau5Bhqg,13,Relevant
P5Etkuev7Oc,Tezpur University,controversies,scam,Tezpur University scam,TEZPUR UNIVERSITY HONEST REVIEW🎓| COURSES📚 | FEES💰| CUT OFF📊 | ELIGIBILITY✅| PLACEMENT💼| EVERYTHING🌟,For All Your Queries Fill out This Profile Analysis Form : https://shorturl.at/4cR8c JOIN OUR WHATSAPP COMMUNITY FOR ...,CUET by Studentkhabri,2024-12-21T10:30:10Z,2024,4476,60,78,PT7M38S,unknown,https://www.youtube.com/watch?v=P5Etkuev7Oc,13,Relevant
Q3X-1OojzH4,Assam University,controversies,scam,Assam University scam,Farewell Lunch ❤ &quot;13 October 2023&quot;  | At Assam University,,Emad Laskar,2023-10-13T19:55:39Z,2023,585,5,0,PT52S,unknown,https://www.youtube.com/watch?v=Q3X-1OojzH4,13,Relevant
4uX9_G29GB0,Tripura University,controversies,scam,Tripura University scam,Juta Mala Kanrwi Tripura University ni khoroksano Tala rewi Khorang tisalaikha,"DONGOUR TV CHANNEL is the exclusive indigeneous kokborok TV channel of Tripura, INDIA which features the programme of ...",DONGOUR TV CHANNEL,2026-05-18T15:19:03Z,2026,2895,54,3,PT4M59S,unknown,https://www.youtube.com/watch?v=4uX9_G29GB0,13,Relevant
Zk4og_ekrmE,Tripura University,controversies,scam,Tripura University scam,tripura University #,,RD Shorts'S,2023-09-10T06:46:16Z,2023,425,17,0,PT15S,unknown,https://www.youtube.com/watch?v=Zk4og_ekrmE,13,Relevant
owvd2LXFZqE,Tripura University,controversies,scam,Tripura University scam,Educational Tour | Dept. Of Physics | Tripura University  | 4th Sem | @kokovlogs26,"tripura #tripurauniversity #agartalaairport #indianmeteorologicaldepartment #agartala #shorts This tour took place on 16th of May, ...",Subhra Jyoti Sur,2023-06-21T07:58:38Z,2023,354,19,4,PT1M45S,unknown,https://www.youtube.com/watch?v=owvd2LXFZqE,13,Relevant
RVIvWWlVRO8,Tripura University,controversies,scam,Tripura University scam,Tripura University ni Vice Chancellor ni Thani Deputation Yapharkha Rwngswrwng Motha ABVP,"Welcome to Chini Khorang Tripura – Your Trusted Source for News, Culture & Updates from Tripura! Stay informed with the latest ...",CHINI KHORANG TRIPURA,2023-09-21T19:26:40Z,2023,86,2,0,PT1M10S,unknown,https://www.youtube.com/watch?v=RVIvWWlVRO8,13,Relevant
jnCu6_nhp4o,Tripura University,controversies,scam,Tripura University scam,Tripura University  ni Vice-Chancellor ni Kayamaya Swnamwi Soksalaikha Rwng Swrwngnaijwksong,Phasalo Haino hai AVBP Student Union ni Twidulmung bai Womens College ni Students rok Khadumani Phunuklaikha. Ah Salo ...,CHINI KHORANG TRIPURA,2026-05-22T11:45:03Z,2026,409,9,1,PT3M35S,unknown,https://www.youtube.com/watch?v=jnCu6_nhp4o,13,Relevant
BrWq2vb3zjE,Tripura University,controversies,scam,Tripura University scam,Botany (General) 5th Semester Paper-V 2018 Tripura University B.Sc Question Paper,,Academic Papers,2023-04-22T12:30:10Z,2023,180,1,0,PT1M5S,unknown,https://www.youtube.com/watch?v=BrWq2vb3zjE,13,Relevant
oJx7BUbHu14,Tripura University,controversies,scam,Tripura University scam,আজ Tripura university  result TDP-BA(Pass)/ B.Sc(Pass)/ B.Com (Pass and Hons) 6th Semester-2023,tripura #tripurauniversity.,Aspirant With General Awareness,2023-09-22T12:06:15Z,2023,1487,12,0,PT9S,unknown,https://www.youtube.com/watch?v=oJx7BUbHu14,13,Relevant
r_KqvnhAlwE,Tripura University,controversies,scam,Tripura University scam,B.Tech Course: Tripura University Admission 2023 | B.Tech Entrance 2023| Class 12th Pass Students,"B.Tech Entrance 2023 | B.Tech Entrance Syllabus | Coaching Guidance Join 7005828529 msg Netaji Chowmuhani, Agartala.",School Of Learning Agartala,2023-06-10T02:22:25Z,2023,354,0,1,PT4M28S,unknown,https://www.youtube.com/watch?v=r_KqvnhAlwE,13,Relevant
dlBwL5eJ13U,Tripura University,controversies,scam,Tripura University scam,Tripura University BBA Students Dance Performance,farewell party 2023 st students  ‍   bba students dance performance kokborok dance #kokborok_song #kokborok_coverdance ...,TL  MOG,2023-06-27T05:30:10Z,2023,234,5,1,PT4M46S,unknown,https://www.youtube.com/watch?v=dlBwL5eJ13U,13,Relevant
7-x0louYnAA,Assam University,controversies,scam,Assam University scam,Assam University B.Ed. Admission 2023 | Apply Now,B.Ed. CET 2023 Complete Course: https://rb.gy/d8bvr Our android app: https://itrvr.on-app.in/app/oc/206566/itrvr Mock Test ...,GTV ASSAM,2023-06-11T11:59:57Z,2023,5934,146,30,PT6M3S,unknown,https://www.youtube.com/watch?v=7-x0louYnAA,13,Relevant
D9n7urAE71Q,Tripura University,controversies,scam,Tripura University scam,Tripura University VCno Churi Offer Khaikha AVBP Tripura!University Gerebnai Studentrog Saklai Rwkha,,Swrangchati News & Entertainment Channel,2026-05-21T13:41:39Z,2026,887,20,5,PT7M46S,unknown,https://www.youtube.com/watch?v=D9n7urAE71Q,13,Relevant
Mkot7MNnzUo,Tripura University,controversies,scam,Tripura University scam,TRIPURA UNIVERSITY DETAILED REVIEW 🏫 | COURSES 📚 | FEES 💰 | CUT OFF 📉 | PLACEMENT 💼 | EVERYTHING 🌟,For All Your Queries Fill out This Profile Analysis Form : https://shorturl.at/4cR8c JOIN OUR WHATSAPP COMMUNITY FOR ...,CUET by Studentkhabri,2024-12-24T10:30:12Z,2024,1511,26,12,PT7M46S,unknown,https://www.youtube.com/watch?v=Mkot7MNnzUo,13,Relevant
lf0rgrZUlcA,Tripura University,controversies,scam,Tripura University scam,tripura University Holi celebration #shorts #reels #tranding #youtubeshorts,,Sribas Tech ,2023-03-10T19:02:07Z,2023,638,8,0,PT16S,unknown,https://www.youtube.com/watch?v=lf0rgrZUlcA,13,Relevant
kwhmyl8drRE,Manipur University,controversies,scam,Manipur University scam,MATAM JAGOI (Manipur University),One of the best performances at the Annual Social Fresher Meet   Credit to the dancer Copyright taD twbi rkkani   #dance ...,Nerish Wahengbam,2024-10-08T17:25:17Z,2024,114068,2102,47,PT10M2S,unknown,https://www.youtube.com/watch?v=kwhmyl8drRE,13,Relevant
YIuTdWb2AcI,Manipur University,controversies,scam,Manipur University scam,"Manipur University CUET Admission form 2023 Eligibility, syllabus cut off 2023",,DAKIYA INFO,2023-01-25T04:33:34Z,2023,514,4,0,PT2M23S,unknown,https://www.youtube.com/watch?v=YIuTdWb2AcI,13,Relevant
tdFJZIzxst4,Tezpur University,controversies,scam,Tezpur University scam,Mess Ending Special Dinner || Tezpur University || University || #tezpuruniversity #dinner,tezpurassam #minivlog #hostellife #tezpuruniversity #tezpur #vlog #dinner #specialdinner #messending.,I M AP,2025-09-03T16:17:02Z,2025,10730,138,16,PT34S,unknown,https://www.youtube.com/watch?v=tdFJZIzxst4,13,Relevant
6cryj-9zPnQ,Manipur University,controversies,scam,Manipur University scam,NIT Manipur University view #hills #beautifulview #manipur,,Knj Arts,2023-10-28T13:45:40Z,2023,103,9,0,PT27S,unknown,https://www.youtube.com/watch?v=6cryj-9zPnQ,13,Relevant
MRKykeyXKNI,Tezpur University,controversies,scam,Tezpur University scam,"Tezpur University MBA Honest Review 2026 | Placement Reality, Fees, ROI &amp; Red Flags Exposed! 🚨",Best Laptops for MBA Students - For All Task https://amzn.to/43Jxnxn https://amzn.to/3QnDSD5 https://amzn.to/4uFpNyL Tezpur ...,Swasata Ghosh,2026-05-24T04:07:09Z,2026,162,14,6,PT5M20S,unknown,https://www.youtube.com/watch?v=MRKykeyXKNI,13,Relevant
xLGgTK3mwyc,Manipur University,controversies,scam,Manipur University scam,Manipur Violence: Manipur University Students ने बताया आंखों  देखा हाल | Kuki Students|Manipur Video,Manipur News: राज्य में 3 मई से घातक छिटपुट हिंसा देखी गई है। यूजीसी के ...,Jansatta,2023-07-22T13:45:03Z,2023,1639,21,4,PT12M10S,unknown,https://www.youtube.com/watch?v=xLGgTK3mwyc,13,Relevant
_bsJa6NeluQ,Tezpur University,controversies,scam,Tezpur University scam,Midsem evening at Tezpur University hostel room | Nilachal Men&#39;s Hostel,Lowest effort at content creation.,Borenya Born,2024-03-17T14:10:22Z,2024,66528,842,46,PT12S,unknown,https://www.youtube.com/watch?v=_bsJa6NeluQ,13,Relevant
SVbix4cRzE4,Manipur University,controversies,scam,Manipur University scam,"Likla Bakery, Manipur University 📌 #manipur",,Mateng Discovery,2024-04-14T04:19:35Z,2024,3125,0,0,PT21S,unknown,https://www.youtube.com/watch?v=SVbix4cRzE4,13,Relevant
WJfEDrThAYU,Manipur University,controversies,scam,Manipur University scam,"Aspects and prospects of Physics - A programme on Department of Physics, Manipur University","DD Manipur Presents Science Programme Aspects and prospects of Physics - A programme on Department of Physics, Manipur ...",Doordarshan Manipur,2025-11-21T05:55:53Z,2025,1695,57,3,PT1H40M45S,unknown,https://www.youtube.com/watch?v=WJfEDrThAYU,13,Relevant
7TBuP8Ha_Oo,Manipur University,controversies,scam,Manipur University scam,Manipur University Cosplay @misonatheblogger,"On 25-04-2025 at Manipur , Cosplay event organised by MANFETE. And other Events also. The cosplayers are Manipur base ...",Misona 360,2025-07-16T15:30:03Z,2025,298,2,0,PT14M27S,unknown,https://www.youtube.com/watch?v=7TBuP8Ha_Oo,13,Relevant
VlcAyCbptHI,Manipur University,controversies,scam,Manipur University scam,Admission Notice Manipur University of Culture #trending #admissionsopen2025 #manipur,,Satyaditya Rajkumar ,2025-08-15T15:59:56Z,2025,1748,56,0,PT1M26S,unknown,https://www.youtube.com/watch?v=VlcAyCbptHI,13,Relevant
vKcpTVaj_uE,Manipur University,controversies,scam,Manipur University scam,"Aspects and prospects of Zoology - A programme on Department of Zoology, Manipur University","DD Manipur Presents Science Programme Aspects and prospects of Zoology A programme on Department of Zoology, Manipur ...",Doordarshan Manipur,2026-01-14T14:50:17Z,2026,2983,94,11,PT1H51M55S,unknown,https://www.youtube.com/watch?v=vKcpTVaj_uE,13,Relevant
