video_id,university_name,category,topic,search_query,title,description,channel_name,upload_date,upload_year,views,likes,comment_count,duration,language,video_url,relevance_score,relevance_label
aZA7i1BCnGs,Dibrugarh University,controversies,scam,Dibrugarh University scam,Dibrugarh University B.Ed Entrance exam 2025 || Dibrugarh University B.Ed Admission || B.Ed exam,Dibrugarh University B.Ed Entrance exam 2025 || Dibrugarh University B.Ed Admission || B.Ed exam #exam assam || #exam ...,Ankuron LIVE ,2025-05-04T02:05:02Z,2025,66,2,0,PT5M5S,unknown,https://www.youtube.com/watch?v=aZA7i1BCnGs,16,Relevant
xhqZ9Lq7WCo,Manipur University,controversies,scam,Manipur University scam,ANNUAL SOCIAL FRESHERS’ MEET | Miss &amp; Mister Manipur University 2025 | MUSU 2025-26,"ANNUAL SOCIAL FRESHERS' MEET Organised by Manipur University Students Union 2025-2026 31th Oct. 2025, Auditorium ...",kumhei,2025-10-31T16:09:12Z,2025,21652,315,3,PT9H23M15S,unknown,https://www.youtube.com/watch?v=xhqZ9Lq7WCo,16,Relevant
0sXV0-ikaAU,Manipur University,controversies,scam,Manipur University scam,From the Campus | Manipur University of Culture | Part 1,DD Manipur Presents From The Campus Manipur University of Culture Part 1 Anchor : Chanchalkumari & Lansana Producer ...,Doordarshan Manipur,2024-09-23T11:07:50Z,2024,8379,280,10,PT29M11S,unknown,https://www.youtube.com/watch?v=0sXV0-ikaAU,16,Relevant
7rc_e0sMh2M,Manipur University,controversies,scam,Manipur University scam,Manipur University Biochemistry Department Ki Leishabi Singga🫰,Manipur University Biochemistry Department ki Leishabi Singga Chengsu Kupsu Charubei Mami Ama Work pressure khara da ...,Dee ToThe Nesh,2026-02-10T11:30:00Z,2026,27527,1020,49,PT11M58S,unknown,https://www.youtube.com/watch?v=7rc_e0sMh2M,16,Relevant
scrFY7tvHIE,Manipur University,controversies,scam,Manipur University scam,Internal Tour of Manipur University Department of Adult Education at last resort 2023,Internal tour of department of adult education Manipur University 2023. It was a very fun and excited tour. Spot - Last Resort ...,Robin Thokchom,2023-03-12T12:18:48Z,2023,146,17,1,PT3M22S,unknown,https://www.youtube.com/watch?v=scrFY7tvHIE,16,Relevant
m_tCMHIXD70,Manipur University,controversies,scam,Manipur University scam,Miss &amp; Mister Manipur University 2025 | Traditional &amp; Introduction Round | Miss Manipur University,Miss & Mister Manipur University 2025 | Traditional & Introduction Round | Miss Manipur University 2025 ANNUAL SOCIAL ...,kumhei,2025-11-01T15:04:23Z,2025,9040,121,5,PT56M36S,unknown,https://www.youtube.com/watch?v=m_tCMHIXD70,16,Relevant
02ueo9nnfwE,Manipur University,controversies,scam,Manipur University scam,Life in Manipur University Girls Hostel || Hostel Experience,"hostellife #manipuruniversity Welcome to a day in the life at the Manipur University Ladies Hostel! In this video, we take you on ...",Jai's Moments,2024-08-24T18:04:41Z,2024,7570,158,66,PT13M1S,unknown,https://www.youtube.com/watch?v=02ueo9nnfwE,16,Relevant
kA73cP1FI4U,Manipur University,controversies,scam,Manipur University scam,Manipur University 2026 | 36 Posts | Apply Online,Manipur University Recruitment 2026 Apply Online | 36 Group B & C Posts Follow Rozgar Hustle for daily job updates ...,Rozgar Hustle,2026-02-07T13:42:00Z,2026,2039,7,0,PT9S,unknown,https://www.youtube.com/watch?v=kA73cP1FI4U,16,Relevant
uas6-08xzk4,Dibrugarh University,controversies,scam,Dibrugarh University scam,Dibrugarh University B.Ed CET 2025 Online Applications Last Date Extended || DU B.Ed CET 2025 ||,"Dibrugarh University B.Ed CET 2025 Online Applications Last Date Extended || DU B.Ed CET 2025 || নমস্কাৰ, মই ...",Ankuron LIVE ,2025-05-25T05:23:51Z,2025,51,0,0,PT1M36S,unknown,https://www.youtube.com/watch?v=uas6-08xzk4,16,Relevant
SSykYW00ATg,Dibrugarh University,controversies,scam,Dibrugarh University scam,Dibrugarh University Diary📖 #shorts #ytshorts #shortsfeed,"Dibrugarh University Diary   #shorts #ytshorts #shortsfeed #shortsvideo Please LIKE, COMMENT & SHARE. Don't forget to ...",Rakhi Manu,2023-06-10T10:30:49Z,2023,620,0,1,PT1M,unknown,https://www.youtube.com/watch?v=SSykYW00ATg,16,Relevant
YZBMDMo8j3c,Dibrugarh University,controversies,scam,Dibrugarh University scam,B.Sc. 3rd Sem CBCS B.Com. 1st Sem NEP Dibrugarh University DU Revaluation Form Rechecking Form 2024,B.Sc. 3rd Sem CBCS B.Com. 1st Sem NEP Dibrugarh University DU Revaluation Form Rechecking Form 2024 3rd sem ...,Justine English,2024-02-14T04:21:57Z,2024,88,0,1,PT1M51S,unknown,https://www.youtube.com/watch?v=YZBMDMo8j3c,16,Relevant
SdNZPOmBXbo,Jadavpur University,controversies,scam,Jadavpur University scam,"Jadavpur University Review 2026 🔥 ROI King? Placements, Cutoff &amp; Reality  | Video -36/365","Jadavpur University Review 2026 | Placements, Cutoff, Fees, Campus & Reality Is Jadavpur University really the ROI King of India ...",College Drisya,2026-02-05T14:57:36Z,2026,623,7,2,PT8M15S,unknown,https://www.youtube.com/watch?v=SdNZPOmBXbo,16,Relevant
iQ8neyo8378,Gujarat University,controversies,scam,Gujarat University scam,Gujarat University Campus Life EXPERT Shares Top College Secrets,Experience the BEST of Gujarat University Campus Life | CollegeDekho - bit.ly/4eiDtse Subscribe to CollegeDekho: ...,CollegeDekho,2024-10-23T05:23:31Z,2024,4544,65,0,PT32S,unknown,https://www.youtube.com/watch?v=iQ8neyo8378,16,Relevant
Kuo1yCJI8iM,Jadavpur University,controversies,scam,Jadavpur University scam,"Jadavpur University Kolkata Review 2026 | Admission, Fees, Cutoff &amp; Placement! | Btech360","Jadavpur University Kolkata Review 2026 | Admission, Fees, Cutoff & Placement! | Btech360 In this video, we cover everything ...",Btech360,2026-03-30T11:24:26Z,2026,2719,56,18,PT26M55S,unknown,https://www.youtube.com/watch?v=Kuo1yCJI8iM,16,Relevant
YPMNxgWxDqw,Lucknow University,controversies,scam,Lucknow University scam,"Lucknow University की Lal Baradari Masjid में नमाज को लेकर भारी बवाल, Bajrang Dal-VHP ने खोला मोर्चा","Lucknow University की Lal Baradari Masjid में नमाज को लेकर भारी बवाल, Bajrang Dal-VHP ने खोला ...",News24 UP & Uttarakhand,2026-02-24T06:48:11Z,2026,1317,22,8,PT3M44S,unknown,https://www.youtube.com/watch?v=YPMNxgWxDqw,16,Relevant
82fV5iqMeh4,Osmania University,controversies,scam,Osmania University scam,"Osmania University Hostels Walkthrough 🚶‍♂️📸 | Safe, Spacious &amp; Budget-Friendly! #LCC #hostellife","Discover the hostel facilities of Osmania University, one of the most iconic campuses in India. From room types and cleanliness to ...",shiksha.com,2025-11-17T17:00:11Z,2025,2808,53,7,PT1M18S,unknown,https://www.youtube.com/watch?v=82fV5iqMeh4,16,Relevant
QTCoPob8I18,Osmania University,controversies,scam,Osmania University scam,Osmania University UG #PGlast chance #oudegreelastchance,Osmania University.,educare,2023-03-27T04:08:49Z,2023,61292,804,69,PT16S,unknown,https://www.youtube.com/watch?v=QTCoPob8I18,16,Relevant
f4PknQjel_o,Osmania University,controversies,scam,Osmania University scam,Osmania university Hyderabad /@Chikuexplore01 #shorts #fypviralシ #hyderabad #osmania_university,Osmania university Hyderabad / @Chikuexplore01 #shorts #fypviralシ #hyderabad #osmania_university osmania university ...,Chiku explore01,2024-08-05T12:40:48Z,2024,26,1,0,PT19S,unknown,https://www.youtube.com/watch?v=f4PknQjel_o,16,Relevant
qi6m68ms6oI,Osmania University,controversies,scam,Osmania University scam,"Osmania university Review : Courses , Fees, Result, Ranking, Placements","Hit this link to jumpstart your career:https://wa.me/918585951111?text=career-guide Osmania university Review : Courses, Fees, ...",shiksha.com,2023-03-15T12:30:32Z,2023,10798,43,5,PT4M16S,unknown,https://www.youtube.com/watch?v=qi6m68ms6oI,16,Relevant
3nO9Xruk7ME,Osmania University,controversies,scam,Osmania University scam,osmania university College of engineering #collegelife #osmaniauniversity,osmania university College of engineering collegelife osmaniauniversity.,Life of Narender,2023-04-30T11:34:18Z,2023,10131,137,13,PT11S,unknown,https://www.youtube.com/watch?v=3nO9Xruk7ME,16,Relevant
YjTvSEMI94g,Osmania University,controversies,scam,Osmania University scam,OSMANIA UNIVERSITY Kab Aur Kisne Banaya  | Jante hai ! | Hyderabad Ki History | TVN99 URDU NEWS,Osmania University Kab Aur Kisne Banaya | Jante hai ! | Hyderabad Ki History | TVN99 URDU NEWS #osmaniauniversity ...,TVN99 URDU NEWS,2024-01-13T13:57:29Z,2024,330,1,0,PT5M7S,unknown,https://www.youtube.com/watch?v=YjTvSEMI94g,16,Relevant
U17L_oJXEjs,Ranchi University,controversies,scam,Ranchi University scam,Ru pg Ma Msc Mcom admission 2023 Open - Ranchi University pg chancellor Portal admission process,Ru pg Ma Msc Mcom admission 2023 Open - Ranchi University pg chancellor Portal admission process Click here to Apply ...,THE COMMERCE WORLD,2023-09-20T15:28:26Z,2023,2804,40,108,PT6M10S,unknown,https://www.youtube.com/watch?v=U17L_oJXEjs,16,Relevant
FP0F3y6Rr4E,Ranchi University,controversies,scam,Ranchi University scam,Fraud prevention #job #frauds #scam #linkedin #google #jobinterview #fake #prevention #tips #jobseek,,Accounts Expert,2024-11-07T00:50:29Z,2024,59570,0,27,PT52S,unknown,https://www.youtube.com/watch?v=FP0F3y6Rr4E,16,Relevant
IU9Toi-j7rA,Andhra University,controversies,scam,Andhra University scam,Andhra University Visakhapatnam Review! #au #andhrauniversity,Andhra University offers various UG and PG courses in regular as well as distance mode. These courses are offered in University ...,College Popcorn,2023-07-06T08:45:20Z,2023,50543,494,143,PT2M2S,unknown,https://www.youtube.com/watch?v=IU9Toi-j7rA,16,Relevant
rf6jWWEyp2o,Ranchi University,controversies,scam,Ranchi University scam,Ranchi University BA/ B.Sc/ B.Com/ Session 2022-25 SEM-1 Old Syllabus || Exam Notice || TextSuport,Ranchi University BA/ B.Sc/ B.Com/ Session 2022-25 SEM-1 Old Syllabus || Exam Notice || TextSuport Ranchi University se apne ...,Text Suport,2023-06-11T01:00:27Z,2023,992,19,9,PT5M44S,unknown,https://www.youtube.com/watch?v=rf6jWWEyp2o,16,Relevant
wJN3WLSzIAg,Ranchi University,controversies,scam,Ranchi University scam,Ranchi University ug admission chancellor Portal Process 2023 | Chancellor portal ug application,Ranchi University Chancellor portal ug admission link 2023 https://bit.ly/2LgMN7x How to add cuet score chancellor Portal full ...,THE COMMERCE WORLD,2023-07-23T16:07:17Z,2023,3820,46,130,PT26M22S,unknown,https://www.youtube.com/watch?v=wJN3WLSzIAg,16,Relevant
nuYAy5B4ReE,Ranchi University,controversies,scam,Ranchi University scam,Tribal Youth Festival 2023 : Ranchi University के दीक्षांत मंडप में होगा Tribal Youth Festival,Tribal Youth Festival 2023 : Ranchi University के दीक्षांत मंडप में होगा Tribal Youth Festival #tribleculture ...,TV45 Bihar Jharkhand,2023-10-15T15:25:56Z,2023,955,12,2,PT16M6S,unknown,https://www.youtube.com/watch?v=nuYAy5B4ReE,16,Relevant
W19ok7T2cyk,Andhra University,controversies,scam,Andhra University scam,Andhra University B Tech 2026 Admissions  with out AP EAPCET 2026 || AUEET 2026 || AP EAPCET 2026,ANDHRA UNIVERSITY B.Tech 2026 Admissions through AUEET 2026 | Complete Guide Planning to join Andhra University for ...,DVSK Lecturs ,2026-04-28T09:00:41Z,2026,9429,0,14,PT2M19S,unknown,https://www.youtube.com/watch?v=W19ok7T2cyk,16,Relevant
Ey5NEU00l4c,Ranchi University,controversies,scam,Ranchi University scam,Ranchi University Marks Sheet Download Process,Ranchi University Marks Sheet Download Process https://bit.ly/3rtWxAy Ranchi University Marks sheet Download Link All Ru ...,THE COMMERCE WORLD,2023-10-03T01:30:11Z,2023,5120,27,66,PT3M17S,unknown,https://www.youtube.com/watch?v=Ey5NEU00l4c,16,Relevant
QK9k9CkETpg,Andhra University,controversies,scam,Andhra University scam,"Andhra University Online Degree | BA, B.Com for Housewives, Students &amp; Employees @ ₹8500 Only!","Andhra University Online Degree | BA, B.Com for Housewives, Students & Employees @ ₹8500 Only!",Raksha Education,2025-07-30T04:05:26Z,2025,6925,41,4,PT15S,unknown,https://www.youtube.com/watch?v=QK9k9CkETpg,16,Relevant
2xjqpnswg0Q,Ranchi University,controversies,scam,Ranchi University scam,छात्रों ने क्यों जड़ दिया Ranchi University गेट पर ताला जानिए क्या है पूरा मामला,"Why did the students lock the Ranchi University gate, know what is the whole matter #ranchi #ranchiuniversity #jharkhandnews ...",22SCOPE,2023-05-16T07:41:48Z,2023,2786,90,3,PT6M49S,unknown,https://www.youtube.com/watch?v=2xjqpnswg0Q,16,Relevant
roiy2F5CkFo,Ranchi University,controversies,scam,Ranchi University scam,Ru Pg admission 2023 - All Pg Colleges Ranchi University pg chancellor Portal admission start Notice,"Ru Pg admission 2023 - All Pg College Ranchi University pg chancellor Portal admission start - Pg Dept, Marwari College, ...",THE COMMERCE WORLD,2023-09-23T08:46:37Z,2023,5077,55,78,PT5M35S,unknown,https://www.youtube.com/watch?v=roiy2F5CkFo,16,Relevant
3tdJbSv_Pa0,Osmania University,controversies,scam,Osmania University scam,CM Revanth Reddy Review Meeting On Osmania University Development | TV5 News,CM Revanth Reddy Review Meeting On Osmania University Development | TV5 NEWS #telangana #latestnews #breakingnews ...,TV5 News Special,2025-12-06T04:57:21Z,2025,546,6,3,PT1M11S,unknown,https://www.youtube.com/watch?v=3tdJbSv_Pa0,16,Relevant
xbcSVB8PQAo,Osmania University,controversies,scam,Osmania University scam,Way to #osmaniauniversity from nearest metro station | Osmania University | Arts college| #hyderabad,The nearest metro station to Osmania University is TARNAKA metro station. #osmaniauniversity #osmania ...,Reethika Surisetty,2023-07-22T12:30:29Z,2023,10775,379,6,PT50S,unknown,https://www.youtube.com/watch?v=xbcSVB8PQAo,16,Relevant
QMB4Qm2NH0g,Patna University,controversies,scam,Patna University scam,"Patna University में उद्घाटन से पहले Deputy CM के सामने भयंकर हंगामा,Shantanu Sekhar ने किया किया?","Patna University में उद्घाटन से पहले Deputy CM के सामने भयंकर हंगामा,Shantanu Sekhar ...",Prabhat Khabar,2026-03-30T13:27:26Z,2026,6379,98,14,PT3M54S,unknown,https://www.youtube.com/watch?v=QMB4Qm2NH0g,16,Relevant
H94mTpLZ0ao,Patna University,controversies,scam,Patna University scam,Patna University BBA Review,Hit this link to jumpstart your career: https://wa.me/918585951111?text=Guide Patna University BBA Review Discover the BBA ...,shiksha.com,2024-11-12T05:20:25Z,2024,15520,27,3,PT3M8S,unknown,https://www.youtube.com/watch?v=H94mTpLZ0ao,16,Relevant
wlmkK9O-UAE,Osmania University,controversies,scam,Osmania University scam,"Osmania University BTech Review | Fees, Admission, Placements, Cutoff",Hit this link to jumpstart your career: https://wa.me/918585951111?text=Guide Osmania University BTech Review Get an in-depth ...,shiksha.com,2024-08-22T10:50:01Z,2024,12989,107,4,PT3M33S,unknown,https://www.youtube.com/watch?v=wlmkK9O-UAE,16,Relevant
EMJ4fxb7Up0,Patna University,controversies,scam,Patna University scam,Patna University BCom Review,Get Free Counselling: https://bit.ly/ShikshaCounselling Patna University BCom Review Wondering how the BCom program at ...,shiksha.com,2025-01-08T06:36:27Z,2025,18002,13,0,PT3M20S,unknown,https://www.youtube.com/watch?v=EMJ4fxb7Up0,16,Relevant
XRpD6ZvZXr0,Patna University,controversies,scam,Patna University scam,Patna University BSc Review,Hit this link to jumpstart your career: https://wa.me/918585951111?text=Guide Patna University BSc Review Discover the BSc ...,shiksha.com,2024-12-18T10:27:12Z,2024,10556,30,4,PT2M50S,unknown,https://www.youtube.com/watch?v=XRpD6ZvZXr0,16,Relevant
RrwgT7c6wVE,Patna University,controversies,scam,Patna University scam,"Patna University Exposed | Classroom, Toilet, Library, Canteen, Sports सब बर्बाद? | Bihar News Pinch","Patna University, once called the “Oxford of the East,” is today struggling with broken infrastructure, poor facilities, lack of quality ...",News Pinch,2025-09-27T14:17:10Z,2025,165135,9377,1773,PT1H20M35S,unknown,https://www.youtube.com/watch?v=RrwgT7c6wVE,16,Relevant
ymhbdb1Vreo,Patna University,controversies,scam,Patna University scam,"Pinch Impact: Patna University VC पर एक्शन, मगर असली जीत अभी बाक़ी है!",Patna University — once called the Oxford of the East — now stands as a symbol of neglect and decay. After News Pinch's ...,News Pinch,2025-10-17T16:07:51Z,2025,622792,48555,1782,PT2M58S,unknown,https://www.youtube.com/watch?v=ymhbdb1Vreo,16,Relevant
jNaW_yOdY88,Ranchi University,controversies,scam,Ranchi University scam,Ranchi University में सब्सिडरी पेपर का EXAM ना होने पर नारा&quot;ज छात्रों ने VC कार्यालय में की तालाबंदी,"About this Video :- Exam of subsidiary paper not held in Ranchi University, angry students lockout in VC office Ranchi University ...",22SCOPE,2023-04-18T08:27:53Z,2023,5301,75,31,PT7M3S,unknown,https://www.youtube.com/watch?v=jNaW_yOdY88,16,Relevant
w-6l7xHgn10,Osmania University,controversies,scam,Osmania University scam,"Osmania University Complete Guide 2025: Review, Ranking, Fees &amp; Admission Explained","Here's everything you need to know about Osmania University, Establishment year: 1918, NIRF Ranking 2024: 43 ...",shiksha.com,2025-07-23T10:01:37Z,2025,2304,8,0,PT1M42S,unknown,https://www.youtube.com/watch?v=w-6l7xHgn10,16,Relevant
btps-fcJ9Co,Ranchi University,controversies,scam,Ranchi University scam,Ranchi University के कौन-कौन से कॉलेज में UG Admission शुरू हुआ?,Ranchi University UG Admission 2026 Update Ranchi University ke kis-kis college me UG Admission 2026 start ho gaya hai aur ...,Sandeep Baitha,2026-05-27T14:05:39Z,2026,2281,60,83,PT3M1S,unknown,https://www.youtube.com/watch?v=btps-fcJ9Co,16,Relevant
ry6bhqQ4Se8,Osmania University,controversies,scam,Osmania University scam,Btech college was emotional and memorable / Btech / Textile technology / Osmania university /EP - 11,"Hello beautiful people, Today I'm gonna tell you about my college life at the time of Btech..... I studied at Osmania university, ...",Stay With Sravs,2024-07-20T03:33:05Z,2024,2062,60,41,PT8M6S,unknown,https://www.youtube.com/watch?v=ry6bhqQ4Se8,16,Relevant
795IeKDebG8,Osmania University,controversies,scam,Osmania University scam,Osmania University MBA Results 2024 | Osmania university mba cbcs results | Shorts,Osmania University MBA Results 2024 | Osmania university mba cbcs results Link ...,Prashanth arsid ,2024-03-11T11:37:05Z,2024,1479,7,3,PT6S,unknown,https://www.youtube.com/watch?v=795IeKDebG8,16,Relevant
JyIWcAbIkm0,Osmania University,controversies,scam,Osmania University scam,Osmania University BE Placements #shorts,"WhatsApp ""Guide"" to 8585951111 and jumpstart your career today! Osmania University BE Placements #shorts Explore the BE ...",shiksha.com,2024-08-22T10:59:50Z,2024,363,4,1,PT18S,unknown,https://www.youtube.com/watch?v=JyIWcAbIkm0,16,Relevant
iSKiFerGPJY,Osmania University,controversies,scam,Osmania University scam,Osmania University canteen #osmania #viralshorts,osmania #techworkstelugu Osmania University College canteen.,TECH WORKS TELUGU,2023-03-31T12:56:51Z,2023,2396,31,1,PT12S,unknown,https://www.youtube.com/watch?v=iSKiFerGPJY,16,Relevant
GKCkdPAeOEU,Andhra University,controversies,scam,Andhra University scam,Andhra University Review |Andhra University Vizag | Andhra University Visakhapatnam | AP EAMCET 2026,"Is Andhra University College of Engineering really the best government engineering college in AP? In this video, I explained ...",The Iconic Faculty,2026-05-23T13:54:52Z,2026,5773,162,70,PT4M16S,unknown,https://www.youtube.com/watch?v=GKCkdPAeOEU,16,Relevant
Hzov-y0eP9k,Andhra University,controversies,scam,Andhra University scam,"Andhra University Visakhapatnam BTech Review | Fees, Admission, Placements, Cutoff",Hit this link to jumpstart your career: https://wa.me/918585951111?text=career-guide Andhra University Visakhapatnam BTech ...,shiksha.com,2024-08-16T15:30:35Z,2024,28442,231,25,PT4M36S,unknown,https://www.youtube.com/watch?v=Hzov-y0eP9k,16,Relevant
apILd_ShAho,Andhra University,controversies,scam,Andhra University scam,Andhra University student review || #MCA || student experience #andhrauniversity #apicet #education,"Andhra University student review || MCA || student experience , college fee, fee reimbursement, regular, self finance, self support, ...",Rajith kumar Diaries ,2025-07-17T13:51:45Z,2025,8451,201,39,PT9M47S,unknown,https://www.youtube.com/watch?v=apILd_ShAho,16,Relevant
2ZzbHLXOiy4,Gujarat University,controversies,scam,Gujarat University scam,Banners stating former Gujarat University professor PP Prajapati as &#39;wanted&#39; pasted in GU campus,"Banners stating former Gujarat University professor PP Prajapati as 'wanted' pasted in GU campus. Professors Ranjan Gohil, PP ...",Zee 24 Kalak,2023-02-14T06:58:49Z,2023,533,8,1,PT2M8S,unknown,https://www.youtube.com/watch?v=2ZzbHLXOiy4,16,Relevant
L7C4kAr9we4,Ranchi University,controversies,scam,Ranchi University scam,#Semester2Result Kab? #Semester3Exam Date 😡 Ranchi University Big Update | Back to Back Exam,Ranchi University Semester 2 Result & Semester 3 Exam Update 2026 इस वीडियो में मैंने Ranchi University ...,Bloom study centre ,2026-03-21T08:41:14Z,2026,1720,0,48,PT8M51S,unknown,https://www.youtube.com/watch?v=L7C4kAr9we4,16,Relevant
cUghVUCs4pQ,University of Rajasthan,controversies,scam,University of Rajasthan scam,Rajasthan University Paper Scam &amp; life #sad #viral #entertament #university exam 😰😥💔🎯🙏📚,,RAJESH PRAJARAJ,2026-06-19T05:16:03Z,2026,529,10,0,PT32S,unknown,https://www.youtube.com/watch?v=cUghVUCs4pQ,16,Relevant
qJnO9ayaclc,Ranchi University,controversies,scam,Ranchi University scam,Ranchi University में बड़ा संकट! | PG Admission और Degree में बड़ी लापरवाही | Jharkhand Student,Ranchi University में बड़ा संकट! | PG Admission और Degree में बड़ी लापरवाही | Jharkhand Student ...,Air Now,2026-02-18T11:30:46Z,2026,620,16,2,PT6M48S,unknown,https://www.youtube.com/watch?v=qJnO9ayaclc,16,Relevant
tcbv1_NCWmI,University of Rajasthan,controversies,scam,University of Rajasthan scam,Rajasthan University Scam #viral #rajasthanuniversity #rajasthanuniversityresult #rajasthanuniversit,,abhi0186,2025-11-23T07:25:58Z,2025,16,2,0,PT42S,unknown,https://www.youtube.com/watch?v=tcbv1_NCWmI,16,Relevant
ZFiB-V7m1lU,Gujarat University,controversies,scam,Gujarat University scam,"Gujarat University 2025| Courses, Eligibility, Fees &amp; Admission Process Explained #gujaratuniversity","Send 'Hey' on WhatsApp 9220339251 for FREE GUIDANCE or Click here https://wa.link/kzuuja Gujarat University, established ...",shiksha.com,2025-08-20T13:11:43Z,2025,7664,79,33,PT2M15S,unknown,https://www.youtube.com/watch?v=ZFiB-V7m1lU,16,Relevant
Ebq39wbZ6ck,Gujarat University,controversies,scam,Gujarat University scam,Best Performance Gujarat university students ||#gujaratuniversity #independenceday,gujaratuniversity #ahmedabad #independenceday Best Performance Gujarat university students ||#gujaratuniversity ...,@Barot123,2023-08-15T07:03:00Z,2023,232,15,0,PT1M1S,unknown,https://www.youtube.com/watch?v=Ebq39wbZ6ck,16,Relevant
Kabf95UpQ3s,Gujarat University,controversies,scam,Gujarat University scam,Gujarat University Commerce Admission 2023 Shedule | Bcom Gujarat University BBa Gujarat University,Gujarat University Commerce Admission 2023 Shedule | Bcom Gujarat University | BBa Gujarat University Website Link   ...,Gujarat College Guide,2023-06-01T06:25:32Z,2023,553,8,6,PT3M41S,unknown,https://www.youtube.com/watch?v=Kabf95UpQ3s,16,Relevant
VAGx3ZPcSsk,Andhra University,controversies,scam,Andhra University scam,Build Your Career with Andhra University Online MBA Program – Direct Admission Open!,Build Your Career with Andhra University Online MBA Program – Direct Admission Open! Build your career with Andhra University ...,College Sarathi - An Initiative By Mr. Aman ,2025-11-07T09:08:32Z,2025,138,2,1,PT2M32S,unknown,https://www.youtube.com/watch?v=VAGx3ZPcSsk,16,Relevant
n_Xpa261z9M,Gujarat University,controversies,scam,Gujarat University scam,How to apply for Gujarat University Exam Paper Re-Assessment / Re-Checking Process for all Courses,How to apply for Gujarat University Exam Paper Re-Assessment / Re-Checking Process for all Courses How to Check Gujarat ...,DKR eLEARNING,2023-01-30T14:05:08Z,2023,10101,99,170,PT6M11S,unknown,https://www.youtube.com/watch?v=n_Xpa261z9M,16,Relevant
RuV0wBclcqU,Gujarat University,controversies,scam,Gujarat University scam,KASHMIR FESTIVAL AT GUJARAT UNIVERSITY 2023,"Welcome facilitation by Gujarat university to university of Kashmir student, Kashmir festival in Gujarat university chief guest ...",Hilal’s Quantum Journey,2023-03-14T05:43:57Z,2023,473,0,1,PT57S,unknown,https://www.youtube.com/watch?v=RuV0wBclcqU,16,Relevant
CLz_gvQ-jGs,Gujarat University,controversies,scam,Gujarat University scam,Gujarat University Review in 1 minute #shorts,"WhatsApp ""Guide"" to 8585951111 and jumpstart your career today! Gujarat University Review in 1 minute #shorts Gujarat ...",shiksha.com,2023-03-11T12:30:08Z,2023,31424,871,17,PT1M,unknown,https://www.youtube.com/watch?v=CLz_gvQ-jGs,16,Relevant
