video_id,university_name,title,description,channel_name,upload_date,upload_year,views,likes,comment_count,duration,language,video_url,relevance_score,relevance_label
MXW5XYhkLnM,IIT Hyderabad,IIT HYDERABAD CAMPUS TOUR 🫰📍 | LIBRARY #iithyderabad #iitmotivation #iitjee #iith #campustour,https://youtu.be/ZXnkpWjZHu8?si=Lap5__JJ_kPKhExF.,Ayush mahobe vlogs,2026-04-19T04:32:53Z,2026,3327,65,0,PT16S,unknown,https://www.youtube.com/watch?v=MXW5XYhkLnM,25,Relevant
K7QUMan0d6A,IIT Indore,IIT Indore Campus Review in 1 min🔥 Best Campus Life of IITs/NITs | IITJEE Motivation #shorts,"Subscribe to our channel for best motivational shorts for JEE, BITSAT and other competitive exams. Best Engineering colleges of ...",Harshal [BITS Pilani] - 10Q Challenge,2023-09-29T12:52:20Z,2023,60154,4076,21,PT58S,unknown,https://www.youtube.com/watch?v=K7QUMan0d6A,25,Relevant
gAp_sMTvwUk,Lovely Professional University,Best University Infrastructure | Sports Complexes | Innovation Studio | State-of-the-art Classroom,"Every corner of the LPU Campus tells a story — of ambition, discovery, and the power of ideas shaped into concrete, steel, and ...",Lovely Professional University - LPU,2025-12-11T11:17:16Z,2025,14557,139,19,PT3M23S,unknown,https://www.youtube.com/watch?v=gAp_sMTvwUk,24,Relevant
7Qq8QLT-0AA,NIT Raipur,NIT RAIPUR CAMPUS TOUR | nit Raipur review | nit Raipur | #nit #nitraipur #nitrr #jee #iit,"Nit Raipur review Begin your engineering dream at NIT Raipur, a premier institute in India! Explore our virtual tour showcasing ...",Rohit Das at NIT Raipur,2024-05-14T15:26:05Z,2024,30499,382,113,PT7M,unknown,https://www.youtube.com/watch?v=7Qq8QLT-0AA,24,Relevant
_D42ILI3Xh8,Chandigarh University,"🎓 Chandigarh University Uncovered: Campus Life, Facilities &amp; Everything You Need to Know! 🏫✨ #LCC","Welcome to Chandigarh University! In this video, we take you on a complete tour of CU's sprawling campus, vibrant student life, ...",shiksha.com,2025-07-11T10:45:10Z,2025,2645,29,18,PT1M3S,unknown,https://www.youtube.com/watch?v=_D42ILI3Xh8,24,Relevant
6mx0LfvulxQ,BITS Pilani,BITS Pilani Complete Campus Tour | The &#39;FEEL&#39; of BITS Pilani | ALLEN,"Explore everything about BITS Pilani on this tour! In this video, We give you a tour of the prestigious college - Birla Institute of ...",ALLEN Career Institute,2023-05-31T02:30:05Z,2023,224367,1523,57,PT2M7S,unknown,https://www.youtube.com/watch?v=6mx0LfvulxQ,24,Relevant
BgXaxIogQcU,IIT Bombay,✈️ Campus Tour of IIT BOMBAY | Top Engineering College in India 🔥 | @ALLENCareerInstituteofficial,"Welcome to the virtual tour of IIT Bombay, one of the most prestigious engineering institutes in the world! In this video, we will take ...",ALLEN Career Institute,2023-03-23T02:30:08Z,2023,810968,9732,461,PT3M25S,unknown,https://www.youtube.com/watch?v=BgXaxIogQcU,24,Relevant
GKB1H409tJ8,University of Hyderabad,🏀 More Than Studies — A Campus Full of Sports &amp; Energy! ⚽ University with great infrastructure and,More Than Studies — A Campus Full of Sports & Energy! ⚽ University with great infrastructure and sports facilities? ✨ Amity ...,Amity Hyderabad,2026-05-12T03:31:37Z,2026,29,0,0,PT5M56S,unknown,https://www.youtube.com/watch?v=GKB1H409tJ8,24,Relevant
CAMjcRuy4Eg,NIT Meghalaya,"NIT Meghalaya Honest Review 2026 🔥 Cutoff, Placements, Fees &amp; Reality","Planning to join NIT Meghalaya in 2026? This honest review covers cutoff trends, real placements, fees, campus life & ground ...",BoringMentor,2026-01-04T15:27:23Z,2026,1452,13,10,PT3M14S,unknown,https://www.youtube.com/watch?v=CAMjcRuy4Eg,24,Relevant
YfZlzg1klpE,IIIT Delhi,Hostel Life | IIIT Delhi | Placements #computerscience #campus #hostel #room #amenities #curfew,"Aniket Goel (IIIT Delhi, CSAM (Computer Science) Engineering, 2020–2024) Thinking about IIIT Delhi or CSAM (Computer ...",AJP Official,2025-10-04T06:31:03Z,2025,544,9,0,PT50S,unknown,https://www.youtube.com/watch?v=YfZlzg1klpE,24,Relevant
SHCS2-_RJio,BITS Pilani,Mess food at BITS PILANI 🤗 #messfood #bitspilani #bitsat #bitsatcutoff #shorts #bitsians #bitsgoa,Mess food at BITS PILANI #messfood #bitspilani #bitsat #bitsatcutoff #shorts #bitsians #bitsgoa #vlog ...,Ankit-BITS PILANI,2024-07-02T07:19:13Z,2024,17813,238,3,PT31S,unknown,https://www.youtube.com/watch?v=SHCS2-_RJio,24,Relevant
OFBmrZo2_LM,IIT Madras,#IIT Madras Hostel Review❤️‍🔥🤩 | Students Change #IITM hostel Sneak-in🙀😱 | #rtr #rtrvlogs,"IIT Madras offers a vibrant and well-equipped hostel life, providing students with comfortable accommodations and a range of ...",RTR Vlogs,2025-05-18T12:30:26Z,2025,1321389,43455,326,PT56S,unknown,https://www.youtube.com/watch?v=OFBmrZo2_LM,24,Relevant
0BzfzraT4Xc,NIT Trichy, nit Trichy sports facilities|| part -2 || #nitt #nittrichy,link for part 1 : https://youtu.be/CBZiuX_ksNA?si=NLUyV8vIYov5Y63R NIT Trichy Sports Facilities Vlog – Part 2 | Description ...,jaisum Brahma [NIT Trichy],2026-03-18T13:27:21Z,2026,180,11,4,PT3M31S,unknown,https://www.youtube.com/watch?v=0BzfzraT4Xc,24,Relevant
MqGHyLxl7tI,IIT Indore,IIT INDORE MESS FOOD!! | WEEKEND SPECIAL🔥🔥,IIT INDORE MESS FOOD | WEEKEND SPECIAL This video is all about the MESS FOOD of IIT Indore ( Weekend edition). What is ...,Kashika Khatri [IIT Indore],2023-05-15T12:04:19Z,2023,21653,281,56,PT2M48S,unknown,https://www.youtube.com/watch?v=MqGHyLxl7tI,24,Relevant
mvxhfMkcPks,VIT Bhopal University,vit bhopal | vit classroom | vit campus tour | vit hostel |#vit #viral #hostellife,,The family's lyf,2023-09-18T16:09:49Z,2023,14257,120,4,PT10S,unknown,https://www.youtube.com/watch?v=mvxhfMkcPks,24,Relevant
tQL0VCdGB4Y,IIT Hyderabad,IIT Hyderabad Campus Walk: A Glimpse into its Impressive Academic Infrastructure #iithyderabad,"Exploring IIT Hyderabad - A Glimpse into Campus Life! Welcome to our channel! In this video, we take you on a virtual tour of ...",Abhinav IIT Hyderabad,2023-08-18T04:39:49Z,2023,4425,260,5,PT27S,unknown,https://www.youtube.com/watch?v=tQL0VCdGB4Y,24,Relevant
UEMk7HeQr90,NIT Warangal,MTech at NIT Warangal: A Typical Day in my Life | NITW Campus Life,"I've been at NIT Warangal for a while now, and many of you asked what the MTech life is actually like here. So, I finally decided to ...",NITian Savita (NIT Warangal),2026-03-10T12:21:13Z,2026,1197,44,12,PT4M8S,unknown,https://www.youtube.com/watch?v=UEMk7HeQr90,24,Relevant
MS-SrYuCG8g,Lovely Professional University,LPU Indoor Sports Complex | Top-Notch Sports Facilities | University With Best Infrastructure |,,Lovely Professional University - LPU,2025-09-22T13:36:18Z,2025,3932,52,0,PT22S,unknown,https://www.youtube.com/watch?v=MS-SrYuCG8g,24,Relevant
pjxvKLsFMh0,Poornima University,"Poornima University Jaipur Sports Facilities | Cricket, Football, Gym &amp; More! #lcc #football","From cricket grounds to basketball courts, Poornima University Jaipur has built a sports culture that goes beyond academics.",shiksha.com,2025-08-15T11:01:32Z,2025,1388,14,7,PT58S,unknown,https://www.youtube.com/watch?v=pjxvKLsFMh0,24,Relevant
0O5RUMdsAvc,Lovely Professional University,LPU&#39;s state-of-the-art Sports infrastructure and training facilities. #shorts | #shortvideo,,Lovely Professional University - LPU,2023-09-08T09:01:04Z,2023,1155,45,0,PT1M1S,unknown,https://www.youtube.com/watch?v=0O5RUMdsAvc,24,Relevant
uifYeeb8nJs,IIIT Naya Raipur,"IIIT Naya Raipur college review | admission, placement, cutoff, fee, campus",College Review playlist: https://www.youtube.com/playlist?list=PL1GuOd_kR3QRHuII8cel7EcQ8JrMDOWaX Review your college ...,Prabhat Ranjan,2023-12-18T09:30:20Z,2023,8874,136,31,PT8M54S,unknown,https://www.youtube.com/watch?v=uifYeeb8nJs,23,Relevant
jwOQgsCvYlI,Nirma University,Girls hostel tour H4 FEAT: Nirma University,Shoutout to my fabulous editor @brain_n_blush #hostel #trending #roomtour #nirmauniversity.,Vidushi Agarwal,2024-08-09T17:10:02Z,2024,31944,332,52,PT6M15S,unknown,https://www.youtube.com/watch?v=jwOQgsCvYlI,23,Relevant
QoxgGB5MUZ8,IIT Ropar,"IIT Ropar English College Review 2026 | Placements, Cutoff, Fees, Hostel, admissions..|","In this video, we bring you a complete and honest review of Indian Institute of Technology Ropar for JEE aspirants 2026. About ...",HACKOVERSE EDU,2026-01-13T13:30:27Z,2026,102,5,1,PT4M23S,unknown,https://www.youtube.com/watch?v=QoxgGB5MUZ8,23,Relevant
yKD-UgCi4hQ,IIIT Bhopal,IIIT BHOPAL Nittr hostel tour,The Indian Institute of Information Technology (IIIT) Bhopal currently operates from a temporary campus at Maulana Azad National ...,Vibhu The Engineer,2025-06-07T11:16:48Z,2025,7115,35,29,PT1M10S,unknown,https://www.youtube.com/watch?v=yKD-UgCi4hQ,23,Relevant
s8Yq64RDt2Q,Lovely Professional University,LPU Genuine College Review from students | LPU University | Lovely Professional University,LPU Honest Review | Students Speak Reality | Admission Guidance 2026 For Admission Guidance & Query fill ...,SUDHIR TUTORIALS,2026-01-29T15:14:43Z,2026,461,13,4,PT9M26S,unknown,https://www.youtube.com/watch?v=s8Yq64RDt2Q,23,Relevant
8hcMb0V1J_w,NIT Rourkela,"NIT Rourkela Telugu College Review 2026 | Placements, Cutoff, Fees, Hostel, admissions..|","In this video, we bring you a complete and honest review of National Institute of Technology Rourkela for **Joint Entrance ...",HACKOVERSE EDU,2026-01-11T11:30:13Z,2026,106,1,0,PT6M14S,unknown,https://www.youtube.com/watch?v=8hcMb0V1J_w,23,Relevant
_ohIqgsUa30,IIIT Bhopal,"IIIT Bhopal college review | admission, placement, cutoff, fee, campus",College Review playlist: https://www.youtube.com/playlist?list=PL1GuOd_kR3QRHuII8cel7EcQ8JrMDOWaX Review your college ...,Prabhat Ranjan,2023-12-14T12:30:30Z,2023,14488,212,57,PT8M54S,unknown,https://www.youtube.com/watch?v=_ohIqgsUa30,23,Relevant
5IMa4CmkFBQ,NIT Surathkal,"NIT Surathkal college review | admission, placement, cutoff, fee, campus",College Review playlist: https://www.youtube.com/playlist?list=PL1GuOd_kR3QRHuII8cel7EcQ8JrMDOWaX Review your college ...,Prabhat Ranjan,2023-10-15T12:30:03Z,2023,1084,36,18,PT8M2S,unknown,https://www.youtube.com/watch?v=5IMa4CmkFBQ,23,Relevant
2mcxgPFMXS4,NIT Bhopal,"NIT Bhopal Hindi College Review 2026 | Placements, Cutoff, Fees, Hostel, Admission","In this video, we bring you a complete and honest review of Maulana Azad National Institute of Technology Bhopal for JEE ...",HACKOVERSE EDU,2026-03-13T23:30:03Z,2026,74,3,0,PT5M35S,unknown,https://www.youtube.com/watch?v=2mcxgPFMXS4,23,Relevant
p2PUW9dXXmo,NIT Nagaland,"NIT Nagaland college review | admission, placement, cutoff, fee, campus",College Review playlist: https://www.youtube.com/playlist?list=PL1GuOd_kR3QRHuII8cel7EcQ8JrMDOWaX Review your college ...,Prabhat Ranjan,2023-11-04T12:30:34Z,2023,4412,93,17,PT11M10S,unknown,https://www.youtube.com/watch?v=p2PUW9dXXmo,23,Relevant
2LBJFP_MEpU,NIT Meghalaya,NIT Meghalaya Campus Tour | Academic Zone Walkthrough |,"In this video, I'm showing you only the front part of our campus — the area where all our classes, labs, and major activities happen ...",D.K,2025-04-26T18:38:33Z,2025,13760,153,157,PT5M5S,unknown,https://www.youtube.com/watch?v=2LBJFP_MEpU,23,Relevant
hFM5sU9HZoE,NIT Warangal,"NIT Warangal Telugu College Review 2026 | Placements, Cutoff, Fees, Hostel, admissions..|","In this video, we bring you a complete and honest review of National Institute of Technology Warangal for JEE aspirants 2026.",HACKOVERSE EDU,2026-01-08T11:30:46Z,2026,241,7,0,PT5M13S,unknown,https://www.youtube.com/watch?v=hFM5sU9HZoE,23,Relevant
PKUm0indK4A,Galgotias University,Galgotias College of Engineering and Technology||  Galgotia University Campus Tour in 1 minutes,"Galgotias College of Engineering and Technology|| Galgotia University Campus Tour in 1 minutesGalgotias University,Galgotias ...", Aditya Singh ,2023-08-07T04:29:42Z,2023,91533,2008,134,PT51S,unknown,https://www.youtube.com/watch?v=PKUm0indK4A,23,Relevant
Og21IXGk_bk,NIT Warangal,"NIT Warangal Hindi College Review 2026 | Placements, Cutoff, Fees, Hostel, admissions..|","In this video, we bring you a complete and honest review of National Institute of Technology Warangal for JEE aspirants 2026.",HACKOVERSE EDU,2026-02-13T11:30:19Z,2026,79,6,0,PT7M33S,unknown,https://www.youtube.com/watch?v=Og21IXGk_bk,23,Relevant
IIYPqADMhmI,IIIT Jabalpur,"IIIT Jabalpur College Review 2024 😍 | Placements, Cutoff, Fees, Ranking ,Sports | IIITDM Jabalpur",Watch IIIT College Review 2025 Playlist ...,TRI-PATH ACADEMY,2024-11-27T14:39:10Z,2024,3825,64,7,PT9M2S,unknown,https://www.youtube.com/watch?v=IIYPqADMhmI,23,Relevant
yBGPaaYSlgw,NIT Arunachal Pradesh,CAMPUS TOUR | NIT ARUNACHAL PRADESH |  తెలుగులో  | MR KESAM,campus #vlogs #nit #arunachalpradesh @MRKESAM.,MR KESAM,2024-04-18T08:15:05Z,2024,22773,1337,192,PT7M22S,unknown,https://www.youtube.com/watch?v=yBGPaaYSlgw,23,Relevant
MjjD6sHkqZ4,VIT Bhopal University,"VIT Bhopal Campus Tour 2025 | Modern, Green &amp; Tech-Driven 🎓✨#LCC #vitbhopal #btechadmissions #campus",Take a closer look at one of India's fastest-growing tech campuses — VIT Bhopal University! This campus tour walks you through ...,shiksha.com,2025-07-24T12:00:50Z,2025,2176,28,6,PT41S,unknown,https://www.youtube.com/watch?v=MjjD6sHkqZ4,23,Relevant
mGMm35FCOgQ,IIIT Guwahati,"IIIT Guwahati Telugu College Review 2026 | Placements, Cutoff, Fees, Hostel, admissions..|","In this video, we bring you a complete and honest review of Indian Institute of Information Technology Guwahati for JEE aspirants ...",HACKOVERSE EDU,2026-01-07T11:30:50Z,2026,227,6,0,PT5M40S,unknown,https://www.youtube.com/watch?v=mGMm35FCOgQ,23,Relevant
1F9sGeM9TL4,Delhi University,Delhi University North Campus Tour!! 🥳 #northcampus #delhiuniversity,Check other courses eligibility requirements :-https://www.youtube.com/playlist?list=PLVHJtEXEMlW3AJAkRoZ5RjVLJc0LwoDlp ...,DU Buddy (Officially Backed by DU Udhmodaya),2024-05-20T04:47:39Z,2024,107522,2576,273,PT13M40S,unknown,https://www.youtube.com/watch?v=1F9sGeM9TL4,23,Relevant
PnL1OVTNM8I,NIT Allahabad,"NIT Allahabad Hindi College Review 2026 | Placements, Cutoff, Fees, Hostel, admissions ","In this video, we bring you a complete and honest review of Motilal Nehru National Institute of Technology Allahabad for JEE ...",HACKOVERSE EDU,2026-03-16T00:30:20Z,2026,135,3,0,PT5M42S,unknown,https://www.youtube.com/watch?v=PnL1OVTNM8I,23,Relevant
LAfPrPx2UOg,SRM Institute of Science and Technology,SRM UNIVERSITY Campus Tour | Main Campus | Kattankulathur,"Certain campuses are etched to showcase the architectural magnificence and the ""SRM Institute of Science and Technology"" ...",Alemari Ganesha,2023-08-31T12:00:09Z,2023,297598,2417,375,PT10M25S,unknown,https://www.youtube.com/watch?v=LAfPrPx2UOg,23,Relevant
grWns5x2FKU,NIT Arunachal Pradesh,NIT ARUNACHAL  PRADESH College Review 2025: Truth About Placements &amp; Campus Life,NIT Arunachal Pradesh is one of the 31 National Institutes of Technology established by the Government of India. It is located in ...,Prabhat Ranjan,2025-10-18T12:30:53Z,2025,6492,119,34,PT10M10S,unknown,https://www.youtube.com/watch?v=grWns5x2FKU,23,Relevant
AC-KaUkip34,IIIT Kottayam,"IIIT Kottayam college review | admission, placement, cutoff, fee, campus",College Review playlist: https://www.youtube.com/playlist?list=PL1GuOd_kR3QRHuII8cel7EcQ8JrMDOWaX Review your college ...,Prabhat Ranjan,2023-12-15T12:30:06Z,2023,8521,119,35,PT12M23S,unknown,https://www.youtube.com/watch?v=AC-KaUkip34,23,Relevant
ZBjgXGe2s-4,NIT Kurukshetra,"NIT Kurukshetra Hindi College Review 2026 | Placements, Cutoff, Fees, Hostel, admissions..|","In this video, we bring you a complete and honest review of National Institute of Technology Kurukshetra for Joint Entrance ...",HACKOVERSE EDU,2026-01-11T12:31:01Z,2026,77,1,0,PT4M23S,unknown,https://www.youtube.com/watch?v=ZBjgXGe2s-4,23,Relevant
YR2xXMdmKQg,KIIT University,Mess food of kiit university #kiituniversity #campus #collegecampus #bhubaneswar #fitness #gym,,Without_edited,2023-09-20T06:30:45Z,2023,330575,1610,118,PT6S,unknown,https://www.youtube.com/watch?v=YR2xXMdmKQg,23,Relevant
jLSWUeomCB0,IIT Madras,🇮🇳 IIT Madras Campus Tour,Thank you for inviting me IIT-ians! I toured the campus for the first time. Its massive! I wish every student gets to enjoy such campus ...,Hobby Explorer,2024-03-08T11:11:31Z,2024,1171638,76063,256,PT39S,unknown,https://www.youtube.com/watch?v=jLSWUeomCB0,23,Relevant
7y_nxD1PdyY,IIIT Gwalior,"IIIT GWALIOR Hindi College Review 2026 | Placements, Cutoff, Fees, Hostel, admissions..|","In this video, we bring you a complete and honest review of Atal Bihari Vajpayee Indian Institute of Information Technology and ...",HACKOVERSE EDU,2026-03-15T17:30:01Z,2026,113,1,0,PT4M2S,unknown,https://www.youtube.com/watch?v=7y_nxD1PdyY,23,Relevant
hkPCGd79pYI,IIT Indore,Night Life at IIT Indore | Campus Tour of IIT Indore,campustour #iitindore #campus #,gov_ind IIT,2024-07-28T00:14:05Z,2024,31783,736,10,PT21S,unknown,https://www.youtube.com/watch?v=hkPCGd79pYI,23,Relevant
vV_-YxdtLBM,IIT Gandhinagar,IIT GandhiNagar CAMPUS TOUR,"Hey Guys, This Video will take you to the superb campus of IIT Gandhi Nagar Please Do Like, Share and Subscribe my Youtube ...",Mechenzi - Campus Tours,2025-05-21T14:51:06Z,2025,3504,41,1,PT5M,unknown,https://www.youtube.com/watch?v=vV_-YxdtLBM,23,Relevant
hYmfoa8ZBow,NIT Arunachal Pradesh,"NIT Arunachal Pradesh Telugu College Review 2026 | Placements, Cutoff, Fees, Hostel, admissions..|","In this video, we bring you a complete and honest review of National Institute of Technology Arunachal Pradesh for JEE aspirants ...",HACKOVERSE EDU,2026-01-24T12:31:03Z,2026,114,3,0,PT5M13S,unknown,https://www.youtube.com/watch?v=hYmfoa8ZBow,23,Relevant
HLm3TVs2y-8,IIIT Lucknow,"IIIT Lucknow college review | admission, placement, cutoff, fee, campus",College Review playlist: https://www.youtube.com/playlist?list=PL1GuOd_kR3QRHuII8cel7EcQ8JrMDOWaX Review your college ...,Prabhat Ranjan,2023-12-12T12:30:13Z,2023,4836,85,17,PT9M2S,unknown,https://www.youtube.com/watch?v=HLm3TVs2y-8,23,Relevant
OVIf6q4swBM,NIT Kurukshetra,"NIT Kurukshetra English College Review 2026 | Placements, Cutoff, Fees, Hostel, admissions..|","In this video, we bring you a complete and honest review of National Institute of Technology Kurukshetra for Joint Entrance ...",HACKOVERSE EDU,2026-01-15T11:30:23Z,2026,100,1,0,PT6M44S,unknown,https://www.youtube.com/watch?v=OVIf6q4swBM,23,Relevant
hNdK-cHoA3g,Pondicherry University,Student life in PONDICHERRY UNIVERISTY- Campus tour,Hi guys here's the snippet of campus life at PONDICHERRY UNIVERSITY I hope you enjoy this video dont forget to subscribe to ...,Life with Krithika,2023-09-16T14:03:49Z,2023,81559,1673,576,PT15M55S,unknown,https://www.youtube.com/watch?v=hNdK-cHoA3g,23,Relevant
lLv_zkG1z_Q,NIT Jamshedpur,"nit jamshedpur full review 2026 | placements, fees, hostel, campus &amp; admission process","nit jamshedpur full review 2026 | placements, fees, hostel, campus & admission process Your Quarries:- nit jamshedpur full ...",Career Margdharshan ,2026-01-08T11:30:50Z,2026,507,0,0,PT10M28S,unknown,https://www.youtube.com/watch?v=lLv_zkG1z_Q,22,Relevant
bH8NKRmHrNY,NIT Hamirpur,🎒🧣NIT HAMIRPUR review | campus life | placement reality #nithamirpur #nith,NIT HAMIRPUR review | campus life | placement reality #nithamirpur #nith #jee2023 #josaa2023 #josaacounseling imp links ...,Carishim,2023-07-10T09:02:51Z,2023,18650,372,255,PT26M15S,unknown,https://www.youtube.com/watch?v=bH8NKRmHrNY,22,Relevant
axLhVuyer-g,Ganpat University,Ganpat University | Review | why Ganpat University | Budget Friendly College | campus Tour |,"WhatsApp:- https://wa.me/qr/GAW6X77G5QXAH1 Ganpat University (GUNI) is a private, not-for-profit institution located in Kherva, ...",Career Aashram,2025-02-20T16:46:11Z,2025,892,37,4,PT17M15S,unknown,https://www.youtube.com/watch?v=axLhVuyer-g,22,Relevant
yrRuXvMb5ks,Banasthali Vidyapith,banasthali vidyapith life /Best college in jaipur/hostel life/ banasthali diaries/trending reel/,Life at Banasthali Vidyapith! Get a glimpse into the fun and real hostel life at one of the best colleges near Jaipur!,Iamprachi,2025-07-20T03:41:12Z,2025,3768,37,10,PT15S,unknown,https://www.youtube.com/watch?v=yrRuXvMb5ks,22,Relevant
7d8vQ_G-nco,NIT Arunachal Pradesh,"🏋️‍♂️ NIT Arunachal Pradesh Sports Life | Playground, Gym &amp; Indoor Games 🎯#LCC #sports #shorts","Discover the amazing sports facilities at NIT Arunachal Pradesh in this video. We show you the outdoor playgrounds, indoor ...",shiksha.com,2025-11-30T10:30:06Z,2025,475,7,1,PT1M9S,unknown,https://www.youtube.com/watch?v=7d8vQ_G-nco,22,Relevant
x9JySKjbS_E,NIT Arunachal Pradesh,😍 What’s on the Plate? NIT Arunachal Pradesh Mess Tour 🍛|Students’ Honest Review 🏫✨#LCC #studentlife,"Wondering what the mess food at NIT Arunachal Pradesh looks like? Here's a complete glimpse into the daily meals, hygiene, ...",shiksha.com,2025-10-14T10:45:07Z,2025,8239,178,15,PT49S,unknown,https://www.youtube.com/watch?v=x9JySKjbS_E,22,Relevant
oHvtjt1mmsU,NIT Jamshedpur,"NIT Jamshedpur Review 2026 – Placement, Campus Life &amp; Truth! | Is NIT Jamshedpur Worth Joining?","NIT Jamshedpur Review 2026 – Placement, Campus Life & Truth! | Is NIT Jamshedpur Worth Joining? :- In this video we are ...",College Option,2026-01-24T12:35:03Z,2026,629,11,6,PT14M21S,unknown,https://www.youtube.com/watch?v=oHvtjt1mmsU,22,Relevant
U6y4iIEjSug,NIT Jamshedpur,"All About NIT Jamshedpur: Fees, Cutoff, Placements &amp; Campus Life | NIT Jamshedpur Complete Review","All About NIT Jamshedpur: Fees, Cutoff, Placements & Campus Life | NIT Jamshedpur Complete Review In this video, we present ...",Education Ji,2025-11-22T19:18:55Z,2025,7868,75,11,PT28M12S,unknown,https://www.youtube.com/watch?v=U6y4iIEjSug,22,Relevant
sFcaHaZXNjQ,NIT Raipur,NIT Raipur Campus Tour Shorts | Freshers Life 💫 #nitraipur #shorts,"Hey everyone , I'm Riya (@nitianriya) and welcome to my channel! Yahan main share karti hoon apni NIT Raipur journey ...",nitianriya ,2025-09-20T03:33:02Z,2025,995,32,3,PT46S,unknown,https://www.youtube.com/watch?v=sFcaHaZXNjQ,22,Relevant
VykL_SfD94c,IIIT Hyderabad,"IIIT Hyderabad Full Overview: Courses, Fees, Campus Life &amp; More!","Looking to join IIIT Hyderabad? In this video, we provide a complete overview of the courses, fees, admission process, campus life ...",AAS - JEE ,2025-03-18T12:26:37Z,2025,57289,577,6,PT45S,unknown,https://www.youtube.com/watch?v=VykL_SfD94c,22,Relevant
Clv7wpWIiLs,NIT Jamshedpur,🎓 NIT JSR Reality Check || Campus Life || Hostel || Infra..,"NIT JSR Reality Check | Campus Life, Hostel, Academics & Truth You Should Know! So finally I made this long “reality” video ...",Pranjal Singh (NIT JSR),2026-03-03T13:32:17Z,2026,2655,60,61,PT15M20S,unknown,https://www.youtube.com/watch?v=Clv7wpWIiLs,22,Relevant
bnsRJd3Ehsg,NIT Nagaland,&quot;Hostel Life at NIT Nagaland:What It&#39;s REALLY Like!&quot;😱,"Welcome to my NIT Nagaland hostel room tour In this video I shall show you 1st year Boys Hostel , hostel room, study setup, daily ...",Sanjeev Gupta ,2026-05-07T14:51:07Z,2026,995,55,20,PT15M,unknown,https://www.youtube.com/watch?v=bnsRJd3Ehsg,22,Relevant
wkJIhCQtcTQ,Nirma University,Nirma University Campus Tour | Life at Nirma,"Experience the vibrant student life and breath-taking beauty of Nirma University! Situated in the heart of Ahmedabad, Gujarat, our ...",Life at Nirma,2023-02-24T06:40:34Z,2023,1186,99,46,PT1M,unknown,https://www.youtube.com/watch?v=wkJIhCQtcTQ,22,Relevant
xCQc2uDjn8g,Poornima University,"Inside Our New AC Hostel: Comfort, Study, &amp; Modern Living | Room Tour","Welcome to our newest hostel – thoughtfully designed for comfort, focus, and modern living! Enjoy air-conditioned rooms that ...",Poornima University,2025-05-23T05:35:05Z,2025,14860,122,13,PT20S,unknown,https://www.youtube.com/watch?v=xCQc2uDjn8g,22,Relevant
ySrx_acKXKM,NIT Silchar,NIT Silchar Hostel ka चप्पा चप्पा दिखा दिया ||Hostel Tour NIT Silchar || NIT ka hostel kaisa hota h.,Namaste doston! Swagat hai aapka mere channel NITian Manohar par. ​Aaj ke is video mein main aapko NIT Silchar ke boys ...,NITian Manohar,2026-04-04T11:48:10Z,2026,599,31,15,PT2M35S,unknown,https://www.youtube.com/watch?v=ySrx_acKXKM,22,Relevant
5T5X3vxUg1A,NIT Jaipur,MNIT JAIPUR SPORTS GROUND TOUR 2023 || Ajju Choudhary Vlog,MNIT JAIPUR SPORTS GROUND TOUR 2023 || Ajju Choudhary Vlog.,Ajju Choudhary vlog,2023-11-17T14:30:40Z,2023,935,25,6,PT7M15S,unknown,https://www.youtube.com/watch?v=5T5X3vxUg1A,22,Relevant
krv4vzrhZc8,SAGE University Indore,"SAGE University Indore Review ⋮ Fees, Scholarships, Placements, Campus Life &amp; Facilities ⋮ MP-DTE",Thinking about attending Sage University Indore (2024)? Hold on! This video gives you the full picture. We explore placements ...,The Rankers Vision,2024-06-29T05:30:11Z,2024,42738,677,56,PT1M,unknown,https://www.youtube.com/watch?v=krv4vzrhZc8,22,Relevant
bju6iurdeZ4,Pandit Deendayal Energy University,VLOG #47 BTS of DevOps workshop at Pandit Deendayal Energy University | Campus Tour &amp; My Review,Join me as I share my incredible experience conducting a 4-day DevOps workshop at Pandit Deendayal Energy University ...,Nomadic Mehul,2024-06-18T12:30:32Z,2024,274,14,12,PT33M50S,unknown,https://www.youtube.com/watch?v=bju6iurdeZ4,22,Relevant
zuBdKljNAhs,IIT Roorkee,IIT Roorkee Campus Tour | Most Beautiful University in India 🇮🇳,"Welcome to IIT Roorkee, one of the most prestigious institutes in India and Asia's oldest technical university. Established in 1847 ...",IITROORKEE-Campus,2025-09-03T13:38:08Z,2025,47513,838,6,PT14S,unknown,https://www.youtube.com/watch?v=zuBdKljNAhs,22,Relevant
