video_id,university_name,title,description,channel_name,upload_date,upload_year,views,likes,comment_count,duration,language,video_url,relevance_score,relevance_label
Hcn01uhFY-I,Chandigarh University,Chandigarh University Campus,Watch this reel by @35mm.uday to experience the serene beauty of Chandigarh University's campus in winter! --- #WinterMagic ...,Chandigarh University - CU,2024-01-15T15:15:02Z,2024,99907,1409,0,PT12S,unknown,https://www.youtube.com/watch?v=Hcn01uhFY-I,18,Relevant
5BseWMSFgB0,NIT Nagaland,NIT Nagaland Campus  tour | A Cinematic Night Video,NIT Nagaland Campus tour | A Cinematic Night Video Let's connect   Instagram: https://www.instagram.com/khrievilieseyie/ ...,NITian Insiders,2024-06-18T18:39:32Z,2024,5119,81,16,PT13S,unknown,https://www.youtube.com/watch?v=5BseWMSFgB0,18,Relevant
pXseaXU15Fw,JECRC University,JECRC University Tour ✨ Student Life &amp; Infrastructure 🎓#LCC #jaipur #campustour #shiksha #shortsfeed,"Take a complete tour of JECRC University Jaipur ✨ In this video, we explore infrastructure, hostels, labs, classrooms, sports areas ...",shiksha.com,2026-02-10T17:01:27Z,2026,549,10,0,PT2M7S,unknown,https://www.youtube.com/watch?v=pXseaXU15Fw,18,Relevant
dAVd5ImwvDs,NIT Nagaland,"Explore NIT Nagaland | Academics, Research, Campus Life &amp; More","Welcome to NIT Nagaland! National Institute of Technology (NIT) Nagaland is a center of academic excellence, innovation, and ...",NIT Nagaland,2025-02-19T10:46:51Z,2025,15575,720,0,PT7M4S,unknown,https://www.youtube.com/watch?v=dAVd5ImwvDs,18,Relevant
1or2vtFBXwc,VIT Bhopal University,VIT Bhopal Campus Tour 🏫✨ Inside India’s Fastest Growing University! #LCC #bhopal #campuslife,"Come along for a complete tour of VIT Bhopal! We explore academic blocks, hostels, food courts, sports areas and the overall ...",shiksha.com,2026-02-13T07:00:01Z,2026,27246,406,47,PT1M54S,unknown,https://www.youtube.com/watch?v=1or2vtFBXwc,18,Relevant
e1Cjf54vi3o,IIIT Kancheepuram,"IIITDM Kancheepuram Telugu College Review 2026 | Placements, Cutoff, Fees, Hostel, admissions","In this video, we bring you a complete and honest review of Indian Institute of Information Technology Design and Manufacturing ...",HACKOVERSE EDU,2026-03-14T02:30:29Z,2026,685,12,4,PT2M49S,unknown,https://www.youtube.com/watch?v=e1Cjf54vi3o,18,Relevant
U71z-3BFjbg,NIT Nagaland,Reality of NIT Nagaland Hostel Rooms.,"Welcome to my NIT Nagaland hostel room tour 🏔️ In this video I'm showing my real hostel room, study setup, daily student life ...",Sachin Meena [NIT-NGL],2026-05-15T04:00:24Z,2026,6370,159,69,PT15M40S,unknown,https://www.youtube.com/watch?v=U71z-3BFjbg,18,Relevant
CC9uOJmK70s,Jawaharlal Nehru University,"JNU का पूरा सच 😱 Fees, Placement, Campus Life | Full Review 2026","अगर आप JNU (Jawaharlal Nehru University) में admission लेने की सोच रहे हैं, तो ये वीडियो ...",Careers360,2026-03-26T10:40:53Z,2026,545,12,1,PT6M2S,unknown,https://www.youtube.com/watch?v=CC9uOJmK70s,17,Relevant
qAwEARbPw_0,Galgotias University,Galgotias College campus 1 | Galgotias college campus tour|| #shorts #viral,"If you are planning to take admission in Greater Noida colleges like Galgotias University, this series will help you understand the ...",Anish Yadav Vlogs,2026-06-03T11:17:22Z,2026,724,11,1,PT13S,unknown,https://www.youtube.com/watch?v=qAwEARbPw_0,17,Relevant
dIbg6EgMRy4,BITS Pilani,"BITS - PILANI, GOA, HYDERABAD College Review 2026 | Placement, Fees, Campus, Reality Check 🔥","BITS Pilani is one of India's premier institutes with campuses in Pilani, Goa, and Hyderabad.It is known for academic excellence, ...",Prabhat Ranjan,2025-12-30T06:30:20Z,2025,9083,150,10,PT14M23S,unknown,https://www.youtube.com/watch?v=dIbg6EgMRy4,17,Relevant
rwG6Ea5Erbc,Lovely Professional University,"Lovely Professional University (LPU) | Admission Process, Fees, Placements, Campus | Honest Review",Drishti (JEE 2026) - https://vdnt.in/Fjr8X Manthan (JEE 2025) - https://vdnt.in/Fjr9q ⚡For Batch Admission Inquiry Fill the Form: ...,Vedantu JEE Made Ejee,2023-04-19T15:33:37Z,2023,355402,8372,730,PT24M16S,unknown,https://www.youtube.com/watch?v=rwG6Ea5Erbc,17,Relevant
NLdmGZSlPwA,IIT Gandhinagar,Gym at IIT Gandhinagar | Facilities at IITGN|,iitgn #iitgandhinagar gym at IIT #jeeadvanced #jeemotivation.,Arjun's World,2024-05-26T10:15:25Z,2024,8615,68,1,PT11S,unknown,https://www.youtube.com/watch?v=NLdmGZSlPwA,17,Relevant
jhybPBcRg0A,Lovely Professional University,LPU Building Tour One of the Best University Infrastructure in India.Lovely Professional University,,A Pixel Perfect.,2025-08-18T05:32:21Z,2025,92,1,0,PT26S,unknown,https://www.youtube.com/watch?v=jhybPBcRg0A,17,Relevant
LRFhAyEtbxk,Chandigarh University,Chandigarh University hostel Life @Chandigarhuniversity #chandigarhuniversity #hostellife,chandigarhuniversity #chandigarh #chandigarhuniversitycampus #youtuber #trending #hostellife #hostel #jim #clg #hostelroom ...,RKG entertainment,2023-04-22T14:36:09Z,2023,62583,0,30,PT21S,unknown,https://www.youtube.com/watch?v=LRFhAyEtbxk,17,Relevant
n46-KTF7F3A,IIIT Delhi,IIIT Delhi Honest College Review #iiit #iiitdelhi #engineering #iitjee #college #iitmotivation #jee,Hey guys recently I visited IIIT - DELHI and got in a student review and he has shared insider tips about the college. More top ...,Kampus Katha,2024-10-03T12:53:26Z,2024,89724,1865,31,PT57S,unknown,https://www.youtube.com/watch?v=n46-KTF7F3A,17,Relevant
HqUt_Jf5pvA,Manipal University Jaipur,Experience Sports Excellence at MUJ,Manipal University Jaipur's state-of-the-art sports facilities are not just arenas; they're the heartbeat of a dynamic community ...,Manipal University Jaipur,2024-05-09T09:16:15Z,2024,6121,75,0,PT37S,unknown,https://www.youtube.com/watch?v=HqUt_Jf5pvA,17,Relevant
SfKtB7vWEr8,NIT Jamshedpur,NuIT Jamshedpur professor in COER U || COER&#39;S collaboration.,"nit jamshedpur, nit jamshedpur campus tour, nit jamshedpur review, nit jamshedpur hostel rooms, nit jamshedpur mess food, nit ...",Campus life vlogs,2025-11-05T04:36:49Z,2025,92,7,0,PT28S,unknown,https://www.youtube.com/watch?v=SfKtB7vWEr8,17,Relevant
72l3iE9FovU,JECRC University,"Experience the Best Hostel Life at JECRC University, Jaipur",Application Form - https://bit.ly/JecrcApplicationForm JECRC Website : https://jecrcuniversity.edu.in/ Also follow us on our all ...,JECRC University,2025-05-14T08:03:10Z,2025,7788,0,5,PT28S,unknown,https://www.youtube.com/watch?v=72l3iE9FovU,17,Relevant
qqcVniQrfwg,NIT Silchar,Campus tour❤️ #nit,In this video I will show you some photos of nit Silchar ❤️ #nit #shorts #jee #advance.,Bibek Sarma,2025-08-24T03:57:05Z,2025,901,22,0,PT39S,unknown,https://www.youtube.com/watch?v=qqcVniQrfwg,17,Relevant
FrHCtC6u7F4,SRM Institute of Science and Technology,"SRMIST: India’s Leading Multidisciplinary University | Infrastructure, Innovation &amp; Student Life","Explore SRM Institute of Science and Technology (SRMIST), Kattankulathur—known for its world-class infrastructure, advanced ...",SRM Institute of Science and Technology,2025-12-04T10:54:43Z,2025,985,9,0,PT8M20S,unknown,https://www.youtube.com/watch?v=FrHCtC6u7F4,17,Relevant
HtTnbcMYL9M,North Eastern Hill University,North Eastern Hill University Shillong | Campus Life | Placements,"Hey, guys in this video i talk about Nehu Shillong Campus. Disclaimer:This video is for educational purpose only. Royal Global ...",Kripan Speaks,2023-03-21T11:11:55Z,2023,406,6,12,PT5M39S,unknown,https://www.youtube.com/watch?v=HtTnbcMYL9M,17,Relevant
Z8UM7Bp0r3A,JECRC University,Campus Life At JECRC University,,JECRC University,2025-04-28T08:40:21Z,2025,109542,0,50,PT13S,unknown,https://www.youtube.com/watch?v=Z8UM7Bp0r3A,17,Relevant
g1szvqVKZhE,IIT Madras,Glass Flume Test Facility (LAB 1) #swayamprabha,"The video provides a tour of the Glass Flume Test Facility at IIT Madras (0:05), detailing its dimensions and three zones: wave ...",CH 32: IIT Madras 02: Bridge Courses,2026-01-09T11:34:32Z,2026,12,0,0,PT4M22S,unknown,https://www.youtube.com/watch?v=g1szvqVKZhE,17,Relevant
Dh497hGQbmg,Pandit Deendayal Energy University,PDEU University Student Review | PDEU Campus &amp; Infrastructure Full Tour,"Pandit Deendayal Energy University- PDEU (Formerly PDPU) Research institution in Gandhinagar, Gujarat Website: ...",Aleem Vlogs,2024-03-13T12:30:15Z,2024,9558,111,26,PT12M59S,unknown,https://www.youtube.com/watch?v=Dh497hGQbmg,17,Relevant
uSmOk0Rt8ow,Pondicherry University,"My College Routine 📚 | Study, Fun &amp; Hostel Life | Pondicherry University | ","A weekly glimpse into my daily college life — classes, seminars, internal paper checks, and all the small moments on campus.",Footloose Loli,2025-11-16T09:43:06Z,2025,963,46,22,PT6M32S,unknown,https://www.youtube.com/watch?v=uSmOk0Rt8ow,17,Relevant
OHoDjpvzUNM,SAGE University Bhopal,"Sage University, bhopal: review on placement, campus tour, admission, 2025-26",Sure! Here's a similar review format for Sage University Bhopal following the structure you provided for Soil Institute of ...,Colleges18,2025-01-26T13:00:32Z,2025,5340,61,7,PT5M26S,unknown,https://www.youtube.com/watch?v=OHoDjpvzUNM,17,Relevant
ZXTy6iWaraE,IIT Gandhinagar,IIT Gandhinagar Hostel 😂📚❌ #iit #shortsfeed #shorts #motivation,IIT Gandhinagar Hostel ❌ #iit #shortsfeed #shorts #motivation Please if you really liked the video then make sure you share ...,Khushbu Mehar [IIT GANDHINAGAR],2023-07-11T14:10:09Z,2023,93264,0,27,PT9S,unknown,https://www.youtube.com/watch?v=ZXTy6iWaraE,16,Relevant
YxIkkdbsDtg,NIT Warangal,"Girls hostel area, hostel tour part 1 #nitwarngal #nitian #dreamnit #iit #topnit #NIT",,Harshita Purohit [NIT Warangal],2025-08-13T09:54:18Z,2025,55919,512,9,PT12S,unknown,https://www.youtube.com/watch?v=YxIkkdbsDtg,16,Relevant
BRKtRCjQcgQ,IIT Bombay,TPPL x IIT Bombay | Building the Future of Healthcare | 10x GMP Facility Showcase,"Welcome to the future of healthcare innovation! ✨ Technolutions Projects Pvt. Ltd. (TPPL), in collaboration with IIT Bombay, ...",TECHNOLUTIONS PROJECTS PVT. LTD,2025-09-17T09:15:27Z,2025,16,1,0,PT53S,unknown,https://www.youtube.com/watch?v=BRKtRCjQcgQ,16,Relevant
5i3CcnyPtyY,IIT Gandhinagar,Birthday Night in IIT HOSTEL 👀🍷🫂🔥IIT GANDHINAGAR 💪🏻#iit #shortsfeed #iitbombay #iitgn #iitian,Birthday Night in IIT HOSTEL IIT GANDHINAGAR #iit #shortsfeed #iitbombay #iitgn #iitian If you really liked the video ...,Khushbu Mehar [IIT GANDHINAGAR],2025-02-23T15:32:00Z,2025,5245,115,10,PT18S,unknown,https://www.youtube.com/watch?v=5i3CcnyPtyY,16,Relevant
rjWRxVyq4Us,IIT Gandhinagar,Girls Hostel IIT Gandhinagar 🔥😳 #song #iit #iitgn #jee2024,Girls Hostel IIT Gandhinagar #song #iit #iitgn #jee2024 If you really liked the video then make sure you share this video as ...,Khushbu Mehar [IIT GANDHINAGAR],2024-01-08T15:33:14Z,2024,47093,0,17,PT14S,unknown,https://www.youtube.com/watch?v=rjWRxVyq4Us,16,Relevant
inrJWlQV5dI,IIT Mandi,My IIT Mandi × Masai Campus Immersion Experience,My IIT Mandi × Masai Campus Immersion Experience - A 3-5 day journey at India's premier IIT campus! Timestamps: 0:00 ...,IIT MANDI ,2025-12-16T11:15:08Z,2025,48336,43,34,PT11M55S,unknown,https://www.youtube.com/watch?v=inrJWlQV5dI,16,Relevant
IucXjAwJ84s,NIT Calicut,🎓 NIT Calicut Moments That Touch Your Heart ❤️ | Campus Life &amp; Culture!,"Experience the vibrant cultural life of NIT Calicut (NITC) — where tradition meets technology, and emotions meet excellence.",Chemistry with Adarsh Singh (NITC),2025-10-22T14:11:15Z,2025,153,7,0,PT55S,unknown,https://www.youtube.com/watch?v=IucXjAwJ84s,16,Relevant
zmVMuMXBaL4,IIT Indore,IIT INDORE | GIRLS HOSTEL #iitindore#iit#iitjee#hostel#iitcampus#iit_motivation#iitjam#sunset#peace,This is the view from my hostel room at IIT Indore. This is how the girls hostel at IIT Indore looks like from the inside. I shot this ...,Kashika Khatri [IIT Indore],2023-05-05T07:09:04Z,2023,20880,379,44,PT11S,unknown,https://www.youtube.com/watch?v=zmVMuMXBaL4,16,Relevant
TtLSPhC1fWg,NIT Bhopal,MANIT Bhopal greenery view 😍😍 #song #love #nit #nitbhopal #campusview #campustour,"MANIT Bhopal | Lush Green Campus Tour | A Breathtaking View of Nature & Infrastructure Welcome to MANIT Bhopal, one ...",@adi_nitian,2025-09-03T02:33:00Z,2025,891,0,0,PT27S,unknown,https://www.youtube.com/watch?v=TtLSPhC1fWg,16,Relevant
DjEyZLx4QeA,NIT Trichy,"NIT Surathkal vs NIT Trichy Which is Better? Ranking, Fees, Campus Life | #nitsurathkal #nittrichy",Send 'Hey' on WhatsApp 8585951111 for FREE Guidance or click here https://wa.link/bopp6q NIT Surathkal vs NIT Trichy – which ...,shiksha.com,2025-06-10T07:51:10Z,2025,5461,58,9,PT1M45S,unknown,https://www.youtube.com/watch?v=DjEyZLx4QeA,16,Relevant
W3DZQqpW8VQ,Chandigarh University,CU Scholar Telugu Student speaks about Chandigarh University Campus,Hear from a Telugu student scholar as they share their inspiring journey and experiences on the vibrant Chandigarh University ...,Chandigarh University - CU,2025-06-18T15:29:35Z,2025,940,23,1,PT1M10S,unknown,https://www.youtube.com/watch?v=W3DZQqpW8VQ,16,Relevant
s3S4l2NwZs8,IIT Gandhinagar,IIT Gandhinagar Classroom 🔥||JEE Motivation #iit #jee #jee2024 #iitgn #iitgandhinagar,IIT Gandhinagar Classroom ||JEE Motivation #iit #jee #jee2024 #iitgn #iitgandhinagar If you really liked the video then make ...,Khushbu Mehar [IIT GANDHINAGAR],2024-01-12T06:05:05Z,2024,56717,0,15,PT10S,unknown,https://www.youtube.com/watch?v=s3S4l2NwZs8,16,Relevant
5yqRsZw1zI4,IIT Gandhinagar,Girls Hostel  of *IIT GANDHINAGAR 🥺❤️#shortsfeed #minivlog #iitiansvlogs #iit #iitgn #motivation,Girls Hostel of *IIT GANDHINAGAR ❤️#shortsfeed #minivlog #iitiansvlogs #iit #iitgn #motivation #iitbombayhostel If you really ...,Khushbu Mehar [IIT GANDHINAGAR],2025-07-12T16:11:00Z,2025,8040,71,6,PT10S,unknown,https://www.youtube.com/watch?v=5yqRsZw1zI4,16,Relevant
VDY5JWBCq5I,Amity University,Amity University || Hostel Life #amitynoida #amityuniversity #dance,Amity University Noida Amity university Amity Noida #amitynoida #amityuniversity #university #amity #dance #lawschool ...,Mr. Lawman vlogs,2023-11-10T20:37:25Z,2023,599195,4148,93,PT10S,unknown,https://www.youtube.com/watch?v=VDY5JWBCq5I,16,Relevant
iSv9SAhd8HM,NIT Calicut,NIT Calicut B.Tech CSE Admission | Campus life | Academics | Placements &amp; opportunities!,"Thinking about joining NIT Calicut for B.Tech CSE? In this video, NIT Calicut seniors share their real experiences about ...",Brilliant Pala - JEE Main & Adv,2026-05-22T14:36:00Z,2026,5959,78,17,PT19M1S,unknown,https://www.youtube.com/watch?v=iSv9SAhd8HM,16,Relevant
flGQp2NN54U,Poornima University,Poornima College of Engineering | Gym Facility,"At PCE, we prioritize both education and health because we understand their equal importance. That's why we offer the best gym ...",Poornima University,2023-06-30T10:10:31Z,2023,9932,145,0,PT16S,unknown,https://www.youtube.com/watch?v=flGQp2NN54U,16,Relevant
B3xkQBYvW_A,SRM Institute of Science and Technology,"SRM Institute of Science and Technology KTR Chennai – B.Tech Review | Fees, Placements, All Campuses","In this video, we bring you a complete review of SRM Institute of Science and Technology (SRM KTR Campus), Chennai, one of ...",Accurate Degrees,2026-03-10T13:15:54Z,2026,904,22,0,PT4M14S,unknown,https://www.youtube.com/watch?v=B3xkQBYvW_A,16,Relevant
-HiWAK5LiZg,NIT Warangal,"NIT Trichy vs NIT Warangal 2025: Fees, Packages, Campus Life Comparison!","Confused between NIT Trichy and NIT Warangal? This video compares both top NITs in terms of fees, placements, average ...",shiksha.com,2025-06-13T13:30:00Z,2025,18155,268,6,PT2M26S,unknown,https://www.youtube.com/watch?v=-HiWAK5LiZg,16,Relevant
qzWAjzMJHIg,NIT Rourkela,NIT ROURKELA MESS FOOD SUNDAY LUNCH VS HALL OF RESIDENCE,Ever wondered what a NIT Rourkela fresher gets in his Sunday Special Lunch at the Vikram Sarabhai Hall of Residence? Today ...,Destinations_by_AP,2026-04-20T23:31:06Z,2026,1147,53,30,PT3M31S,unknown,https://www.youtube.com/watch?v=qzWAjzMJHIg,16,Relevant
b6FWXeEYD8I,Chandigarh University,CU Scholar Telugu Students speak about Chandigarh University Campus,Hear from a Telugu student scholar as they share their inspiring journey and experiences on the vibrant Chandigarh University ...,Chandigarh University - CU,2025-06-26T12:44:25Z,2025,764,25,1,PT1M12S,unknown,https://www.youtube.com/watch?v=b6FWXeEYD8I,16,Relevant
4lrOGT-ndZw,Kalinga University Raipur,A Real Student&#39;s Journey to Find the Right University | Vaniya Sharma | Campus Tour | Part-1,"What happens when a student travels all the way from Delhi to explore a university for her future? ✈️ For Vaniya Sharma, her ...",Kalinga University,2026-06-03T06:33:01Z,2026,75,2,1,PT1M30S,unknown,https://www.youtube.com/watch?v=4lrOGT-ndZw,16,Relevant
XCgT7vvpfJA,LNCT Bhopal,IES University Bhopal infrastructure #IES University view#IES University campus,IES University Bhopal infrastructure #IES University view#IES University campus.,Raushan k official ,2024-07-16T05:40:07Z,2024,2905,53,2,PT14S,unknown,https://www.youtube.com/watch?v=XCgT7vvpfJA,16,Relevant
lmmhGlpKGzA,IIT Patna,"Inside IIT Patna’s 2025 Campus Immersion 💡 Mentorship, Innovation &amp; Epic Moments!",Welcome Aboard the Immersion! Immersion. Inspiration. Impact. Join us as IIT Patna's 2025 Campus Immersion Experience ...,Indian Institute of Technology Patna,2025-06-13T06:30:32Z,2025,4220597,74,3,PT49S,unknown,https://www.youtube.com/watch?v=lmmhGlpKGzA,16,Relevant
jqCIT9oYPok,NIT Silchar,"NIT Silchar MBA Review 2026 — Fees, Placements, Campus Life | Sach Bolunga Main 🎓",Is NIT Silchar MBA worth it in 2026? Is this the right MBA college for you — ya phir paisa aur do saal barbaad ho jayenge?,Swasata Ghosh,2026-05-26T07:58:35Z,2026,78,14,2,PT9M,unknown,https://www.youtube.com/watch?v=jqCIT9oYPok,16,Relevant
Bfz-L_e0OII,SAGE University Indore,One Campus. Endless Career Opportunities | Explore SAGE University Indore | Apply Today,Planning a future that truly works for you? SAGE University Indore brings together 100+ undergraduate and postgraduate ...,SAGE University Indore,2026-02-11T23:03:27Z,2026,192,0,0,PT46S,unknown,https://www.youtube.com/watch?v=Bfz-L_e0OII,16,Relevant
Jo8O2ht9ZEE,Chandigarh University,Chandigarh University Campus | Best University in Punjab,Learning under blue skies and bright minds — just another beautiful day at Chandigarh University. ☀️   Every day is an ...,Chandigarh University - CU,2025-06-16T11:14:27Z,2025,36549,520,2,PT10S,unknown,https://www.youtube.com/watch?v=Jo8O2ht9ZEE,16,Relevant
Js5poNw7eGk,SAGE University Bhopal,SAGE University Bhopal में Admission लेने से पहले ये Video जरूर देखो! Placement/ Fees/ Campus Life ,"अगर आप SAGE University Bhopal में admission लेने का सोच रहे हो, तो यह वीडियो आपके लिए ...",Harshu Yadav vlogs,2026-05-13T08:25:03Z,2026,127,4,9,PT5M15S,unknown,https://www.youtube.com/watch?v=Js5poNw7eGk,16,Relevant
HvccSXtklT0,VIT Bhopal University,Campus Life at VIT Bhopal | More Than Just a University Experience,What does everyday student life at an engineering university actually look like? Campus life at VIT Bhopal is designed to support ...,VIT BHOPAL Official,2026-05-25T07:43:14Z,2026,297442,100,0,PT3M53S,unknown,https://www.youtube.com/watch?v=HvccSXtklT0,16,Relevant
Uee2hCDkz_k,University of Hyderabad,Glimpses of Research facilities in University of Hyderabad,Research and Innovation has been the major thrust of the University of Hyderabad since its inception. The University encourages ...,University of Hyderabad,2023-05-23T05:43:01Z,2023,1647,52,0,PT6M3S,unknown,https://www.youtube.com/watch?v=Uee2hCDkz_k,16,Relevant
BFJ084BkhMw,IIT Jodhpur,IIT Jodhpur these days 🔥 #iitjodhpur #iit #iitjee #hostel #campus #explore #ytshorts #viral #iitian,POV : IIT Jodhpur these days.,Bunty Verma,2025-04-18T12:33:10Z,2025,106330,1408,21,PT11S,unknown,https://www.youtube.com/watch?v=BFJ084BkhMw,16,Relevant
o7DiZ7CYTMI,SRM Institute of Science and Technology,SRM Kattankulathur Green Campus and new Entrance Arch @SamFacultyLife #Shorts #Chennai,"Impressive Infrastructure, Green campus, Multilingual, and Multicultural campus human-friendly campus - SRM Kattanulathur.",Sam Faculty Life,2023-09-29T09:40:52Z,2023,771,34,0,PT23S,unknown,https://www.youtube.com/watch?v=o7DiZ7CYTMI,16,Relevant
TGNSWiF1DrY,IIIT Bhopal,"IIIT BHOPAL | IIIT BHOPAL PLACEMENTS | IIIT BHOPAL FEES, CUTOFF, HOSTEL, CAMPUS | MNIT BHOPAL","Hello Everyone, This video tells you the complete & most important details about IIIT Bhopal with it's latest placements, fees, cutoff, ...",Freshers Gate,2025-05-06T13:30:25Z,2025,8245,62,38,PT4M31S,unknown,https://www.youtube.com/watch?v=TGNSWiF1DrY,16,Relevant
KfgavE4kHcg,Banasthali Vidyapith,Banasthali Vidyapith Apaji Fest | Banasthali Apaji Mela 2025 | Full Campus Vlog 🎡,"Welcome to my Banasthali Vidyapith Apaji Mela 2025 Vlog! ✨ In this vlog, I'm taking you through the beautiful and vibrant Apaji ...",SHIVANI SINGH Gallery,2025-12-10T10:37:53Z,2025,1617,33,12,PT10M41S,unknown,https://www.youtube.com/watch?v=KfgavE4kHcg,16,Relevant
4jBnrX8oko8,SRM Institute of Science and Technology,Campus Life at SRM University-AP,"College is a chapter of endless memories and lifelong lessons. Where every class feels like an adventure, every snack break is a ...","SRM University - AP, Andhra Pradesh",2024-11-28T08:30:01Z,2024,175938,2728,0,PT22S,unknown,https://www.youtube.com/watch?v=4jBnrX8oko8,16,Relevant
W-d3HyzO8G4,Manipal University Jaipur,Pride in Every Frame | 77th Republic Day Celebration at Manipal University Jaipur,Experience the spirit of patriotism and nation-building at Manipal University Jaipur as the campus celebrates the 77th Republic ...,Manipal University Jaipur,2026-01-30T14:40:17Z,2026,300,13,0,PT6M37S,unknown,https://www.youtube.com/watch?v=W-d3HyzO8G4,16,Relevant
HqIrW3Ab-dM,IIT Gandhinagar,Beautiful Campus 😻✅||IIT GANDHINAGAR||#iit #iitgandhinagar #shortsfeed #shorts #motivation,Beautiful Campus ✓||IIT GANDHINAGAR||#iit #iitgandhinagar #shortsfeed #shorts #motivation Please if you really liked the ...,Khushbu Mehar [IIT GANDHINAGAR],2023-08-11T13:46:14Z,2023,5010,0,4,PT9S,unknown,https://www.youtube.com/watch?v=HqIrW3Ab-dM,16,Relevant
glEwfm7S0Qk,Manipal University Jaipur,Campus Life at MUJ,Immerse yourself in the calming embrace of nature and meet some furry friends while you stroll the campus of Manipal University ...,Manipal University Jaipur,2024-02-14T05:48:44Z,2024,3463,97,0,PT15S,unknown,https://www.youtube.com/watch?v=glEwfm7S0Qk,16,Relevant
jnnoikU1DnU,IIIT Guwahati,iiit guwahati classroom #jee #iiit #iiitguwahati #ytshorts #shortsviral,iiit guwahati classroom #jee #iiit #iiitguwahati #ytshorts #shortsviral.,High Flyers[IIIT GUWAHATI],2023-04-29T05:46:38Z,2023,7525,56,42,PT10S,unknown,https://www.youtube.com/watch?v=jnnoikU1DnU,16,Relevant
aOWjJdKVU94,IIT Patna,MTech MnC at IIT Patna: Best of Both Worlds | Placements | Course Structure | Campus Life,The M.Tech program in Mathematics and Computing (MnC) at IIT Patna was started in 2012. It is a specialized postgraduate ...,Shashank Jha,2026-04-22T18:55:34Z,2026,570,18,58,PT15M59S,unknown,https://www.youtube.com/watch?v=aOWjJdKVU94,16,Relevant
1nPwm60Rgio,IIT Patna,Central library of IIT Patna💫 #shorts #iitpatna #centrallibrary #viral #shortsfeed #patna #bihar,Central library of IIT Patna   #shorts #iitpatna #centrallibrary #viral #shortsfeed #patna #bihar.,Ravi Shroff [IIT Patna],2025-07-22T06:16:42Z,2025,25316,633,12,PT17S,unknown,https://www.youtube.com/watch?v=1nPwm60Rgio,16,Relevant
-86s1J_hra0,IIIT Lucknow,"IIIT Lucknow Honest Review 2026 | Placements, Cutoff, Hostel &amp; Reality| Video -28/365","In This video, we bring you an honest and detailed review of IIIT Lucknow for 2026 aspirants. We cover everything you need to ...",College Drisya,2026-01-28T17:35:25Z,2026,1740,16,13,PT7M32S,unknown,https://www.youtube.com/watch?v=-86s1J_hra0,16,Relevant
mu-zAWcEcV4,Delhi University,Delhi University biggest college fest  #du #dtu #college #fest #srcc #collegelife #cuet #dream #like,delhi university delhi university campus srcc delhi university staff protest best du college college life maitreyi college university of ...,Sarkari Naukri,2025-07-25T14:59:43Z,2025,317846,3571,97,PT18S,unknown,https://www.youtube.com/watch?v=mu-zAWcEcV4,16,Relevant
AeUa7MFs2WU,Pandit Deendayal Energy University,PDEU | Campus Life | Admissions Open 2024,"PDEU has an enormous campus of 100 acres with lush greenery all around. With the best of both world amenities, you'll find ...",Pandit Deendayal Energy University - PDEU,2024-05-15T04:55:09Z,2024,20461,214,2,PT41S,unknown,https://www.youtube.com/watch?v=AeUa7MFs2WU,16,Relevant
FyUwEXRQ-co,NIT Jaipur,Nit Jaipur Classroom / Lecture room || VLTC || MNIT JAIPUR ||#jee #nitjaipur #vltc #nit #engineering,Classroom/ lecture room (VLTC ) NIT JAIPUR FULL TOUR* | Asia's Largest Lecture Theatre | Complete Inside + 360° View ...,Saumya's trails [NIT JAIPUR],2026-03-29T13:10:00Z,2026,185,13,2,PT3M39S,unknown,https://www.youtube.com/watch?v=FyUwEXRQ-co,16,Relevant
ydQxSNohZkk,IIIT Gwalior,Sunday Mess Food at IIITM Gwalior Campus,Hey Guys! In this video I shared what food available in sunday at IIITM GWALIOR Mess.,Kiran@IIITIAN,2025-09-08T10:35:03Z,2025,2485,36,8,PT1M2S,unknown,https://www.youtube.com/watch?v=ydQxSNohZkk,16,Relevant
_zi1kIM4KgM,Amity University,"Truth About Amity University Noida 2026 ⚠️ Fees, Placements &amp; Reality","Thinking about joining Amity University Noida in 2026? This honest review reveals the real fees, placements, campus life, and ...",vidhyaa.in,2026-03-10T15:01:05Z,2026,2685,21,1,PT9M9S,unknown,https://www.youtube.com/watch?v=_zi1kIM4KgM,16,Relevant
